3139297,chr17,16952447,G,T,stop_gained&splice_region_variant,HIGH,TNFRSF13B,4.594e-05,1.437e-05,Pathogenic,ENST00000261652.7:c.198C>A,ENSP00000261652.2:p.Cys66Ter,TACI deficiency,609529| 240500,Variable clinical expression,"AF_EXAC=1e-05;AF_TGP=0.0002;ALLELEID=844739;CLNDISDB=MONDO:MONDO:0009413,MedGen:C3150354,OMIM:240500,Orphanet:1572|MONDO:MONDO:0012291,MedGen:C1836032,OMIM:609529;CLNDN=Immunodeficiency,_common_variable,_2|Immunoglobulin_A_deficiency_2;CLNHGVS=NC_000017.11:g.16952447G>T;CLNREVSTAT=criteria_provided,_multiple_submitters,_no_conflicts;CLNSIG=Pathogenic;CLNSIGSCV=SCV001206752|SCV001429954|SCV002573177|SCV005398060;CLNVC=single_nucleotide_variant;CLNVCSO=SO:0001483;CLNVI=ClinGen:CA8414090;GENEINFO=TNFRSF13B:23495;MC=SO:0001587|nonsense;ORIGIN=5;RS=144718007","criteria_provided,_multiple_submitters,_no_conflicts",0.444,SNV,GT:AD:AF:DP:F1R2:F2R1:SB,"0/1:43,33:0.444:76:20,17:14,9:28,15,20,13",1964.0,43.0,Female,British,,,"B95.1 Streptococcus, group B, as the cause of diseases classified to other chapters|B95.6 Staphylococcus aureus as the cause of diseases classified to other chapters|B96.5 Pseudomonas (aeruginosa)(mallei)(pseudomallei) as the cause of diseases classified to other chapters|E66.9 Obesity, unspecified|E87.6 Hypokalaemia|G55.1 Nerve root and plexus compressions in intervertebral disk disorders|I10 Essential (primary) hypertension|M00.05 Staphylococcal arthritis and polyarthritis (Pelvic region and thigh)|M00.25 Other streptococcal arthritis and polyarthritis (Pelvic region and thigh)|M00.85 Arthritis and polyarthritis due to other specified bacterial agents (Pelvic region and thigh)|M51.1 Lumbar and other intervertebral disk disorders with radiculopathy|O26.9 Pregnancy-related condition, unspecified|O32.0 Maternal care for unstable lie|O34.2 Maternal care due to uterine scar from previous surgery|O48 Prolonged pregnancy|O63.1 Prolonged second stage (of labour)|O64.0 Obstructed labour due to incomplete rotation of foetal head|O68.2 Labour and delivery complicated by foetal heart rate anomaly with meconium in amniotic fluid|R06.8 Other and unspecified abnormalities of breathing|R69 Unknown and unspecified causes of morbidity|W19.0 Home|Z35.2 Supervision of pregnancy with other poor reproductive or obstetric history|Z37.0 Single live birth","G55.1 Nerve root and plexus compressions in intervertebral disk disorders|M00.05 Staphylococcal arthritis and polyarthritis (Pelvic region and thigh)|O26.9 Pregnancy-related condition, unspecified|O32.0 Maternal care for unstable lie|O34.2 Maternal care due to uterine scar from previous surgery|O63.1 Prolonged second stage (of labour)|R69 Unknown and unspecified causes of morbidity","B95.1 Streptococcus, group B, as the cause of diseases classified to other chapters|B95.6 Staphylococcus aureus as the cause of diseases classified to other chapters|B96.5 Pseudomonas (aeruginosa)(mallei)(pseudomallei) as the cause of diseases classified to other chapters|E66.9 Obesity, unspecified|E87.6 Hypokalaemia|I10 Essential (primary) hypertension|M00.25 Other streptococcal arthritis and polyarthritis (Pelvic region and thigh)|M00.85 Arthritis and polyarthritis due to other specified bacterial agents (Pelvic region and thigh)|M51.1 Lumbar and other intervertebral disk disorders with radiculopathy|O48 Prolonged pregnancy|O64.0 Obstructed labour due to incomplete rotation of foetal head|O68.2 Labour and delivery complicated by foetal heart rate anomaly with meconium in amniotic fluid|R06.8 Other and unspecified abnormalities of breathing|Z35.2 Supervision of pregnancy with other poor reproductive or obstetric history|Z37.0 Single live birth",,,,7.39,,35.43,,58.4,105.1,352.0,2.6,26.3,31.9,35.8,89.2,11.8,109.9,81.1,0.4,4.3,6.7,66.7,0.0,0.0,241.0,0.283,17.1,4.33,13.7,0.104,2.41,10.0,,"['4.17', '4.01', '3.86']","['3.54', '3.09', '2.97']"
3165186,chr17,42329423,C,T,missense_variant,MODERATE,STAT3,6.57e-06,,Pathogenic,ENST00000264657.10:c.1268G>A,ENSP00000264657.4:p.Arg423Gln,AD-HIES  Job syndrome| STAT3 GOF mutation,147060| 615952,"Distinctive facial features (broad nasal bridge), bacterial infections (boils and pulmonary abscesses, pneumatoceles) due to S. aureus, pulmonary aspergillus, Pneumocystis jirovecii, eczema, mucocutaneous candidiasis, hyperextensible joints, osteoporosis and bone fractures, scoliosis, retention of primary teeth,  coronary and cerebral aneurysm formation| Lymphoproliferation, solid organ autoimmunity, recurrent infections","ALLELEID=33345;CLNDISDB=MONDO:MONDO:0014414,MedGen:C4014795,OMIM:615952,Orphanet:438159|MONDO:MONDO:0007818,MedGen:C2936739,OMIM:147060,Orphanet:2314|MedGen:C4288261;CLNDN=STAT3-related_early-onset_multisystem_autoimmune_disease|Hyper-IgE_recurrent_infection_syndrome_1,_autosomal_dominant|STAT3_gain_of_function;CLNHGVS=NC_000017.11:g.42329423C>T;CLNREVSTAT=criteria_provided,_multiple_submitters,_no_conflicts;CLNSIG=Pathogenic;CLNSIGSCV=SCV001526137|SCV002572907|SCV004571430;CLNVC=single_nucleotide_variant;CLNVCSO=SO:0001483;CLNVI=ClinGen:CA341508|OMIM:102582.0004|UniProtKB:P40763#VAR_037371;GENEINFO=STAT3:6774;MC=SO:0001583|missense_variant;ORIGIN=1;RS=113994137","criteria_provided,_multiple_submitters,_no_conflicts",0.041,SNV,GT:AD:AF:DP:F1R2:F2R1:SB,"0/1:82,3:0.041:85:44,2:20,0:47,35,2,1",1962.0,47.0,Female,British,,,"C56 Malignant neoplasm of ovary|D64.9 Anaemia, unspecified|N62 Hypertrophy of breast|N70.0 Acute salpingitis and oophoritis|Z12.1 Special screening examination for neoplasm of intestinal tract|Z51.5 Palliative care|Z85.4 Personal history of malignant neoplasm of genital organs","C56 Malignant neoplasm of ovary|D64.9 Anaemia, unspecified|N62 Hypertrophy of breast|Z12.1 Special screening examination for neoplasm of intestinal tract",C56 Malignant neoplasm of ovary|N70.0 Acute salpingitis and oophoritis|Z51.5 Palliative care|Z85.4 Personal history of malignant neoplasm of genital organs,,ovarian cancer,['2002'],0.45,,17.17,21.6,23.0,59.2,333.5,1.56,32.81,33.65,37.19,90.46,8.6,104.75,78.23,0.28,5.82,2.71,57.0,0.0,0.0,279.4,0.24,16.32,3.655,12.57,0.051,1.408,4.76,,"['2.7', '2.45', '2.72']","['2.18', '2.09', '2.22']"
3181711,chr20,63687765,G,T,missense_variant,MODERATE,RTEL1,6.568e-06,2.112e-05,Pathogenic/Likely_pathogenic,ENST00000360203.11:c.1476G>T,ENSP00000353332.5:p.Met492Ile,DKCA4,616373,"Bone marrow failure, pulmonary and hepatic fibrosis, nail dystrophy, leukoplakia, reticulate skin pigmentation; microcephaly, neurodevelopmental delay","AF_ESP=8e-05;AF_EXAC=6e-05;ALLELEID=51187;CLNDISDB=MONDO:MONDO:0014076,MedGen:C3554656,OMIM:615190|MONDO:MONDO:0014613,MedGen:C4225346,OMIM:616373,Orphanet:2032|MedGen:C3661900|MONDO:MONDO:0015780,MedGen:C0265965,OMIM:PS127550,Orphanet:1775;CLNDN=Dyskeratosis_congenita,_autosomal_recessive_5|Pulmonary_fibrosis_and/or_bone_marrow_failure,_Telomere-related,_3|not_provided|Dyskeratosis_congenita;CLNHGVS=NC_000020.11:g.63687765G>T;CLNREVSTAT=criteria_provided,_multiple_submitters,_no_conflicts;CLNSIG=Pathogenic/Likely_pathogenic;CLNSIGSCV=SCV000699742|SCV000964946|SCV003812007|SCV004169101|SCV004209343;CLNVC=single_nucleotide_variant;CLNVCSO=SO:0001483;CLNVI=ClinGen:CA130949|OMIM:608833.0003;GENEINFO=RTEL1:51750|RTEL1-TNFRSF6B:100533107;MC=SO:0001583|missense_variant,SO:0001619|non-coding_transcript_variant;ORIGIN=1;RS=370343781","criteria_provided,_multiple_submitters,_no_conflicts",0.522,SNV,GT:AD:AF:DP:F1R2:F2R1:SB,"0/1:34,37:0.522:71:11,12:17,20:14,20,15,22",1958.0,50.0,Female,British,,,K01.1 Impacted teeth,K01.1 Impacted teeth,,,,,0.58,,9.49,21.5,17.0,95.4,175.4,1.45,29.07,30.51,33.08,92.25,10.46,111.02,81.68,0.39,7.76,2.92,58.5,0.0,0.0,266.4,0.278,16.01,4.459,13.69,0.043,0.967,4.99,,"['4.01', '3.88']","['3.24', '3.15']"
3190950,chr17,16952447,G,T,stop_gained&splice_region_variant,HIGH,TNFRSF13B,4.594e-05,1.437e-05,Pathogenic,ENST00000261652.7:c.198C>A,ENSP00000261652.2:p.Cys66Ter,TACI deficiency,609529| 240500,Variable clinical expression,"AF_EXAC=1e-05;AF_TGP=0.0002;ALLELEID=844739;CLNDISDB=MONDO:MONDO:0009413,MedGen:C3150354,OMIM:240500,Orphanet:1572|MONDO:MONDO:0012291,MedGen:C1836032,OMIM:609529;CLNDN=Immunodeficiency,_common_variable,_2|Immunoglobulin_A_deficiency_2;CLNHGVS=NC_000017.11:g.16952447G>T;CLNREVSTAT=criteria_provided,_multiple_submitters,_no_conflicts;CLNSIG=Pathogenic;CLNSIGSCV=SCV001206752|SCV001429954|SCV002573177|SCV005398060;CLNVC=single_nucleotide_variant;CLNVCSO=SO:0001483;CLNVI=ClinGen:CA8414090;GENEINFO=TNFRSF13B:23495;MC=SO:0001587|nonsense;ORIGIN=5;RS=144718007","criteria_provided,_multiple_submitters,_no_conflicts",0.505,SNV,GT:AD:AF:DP:F1R2:F2R1:SB,"0/1:55,55:0.505:110:18,24:23,20:29,26,30,25",1953.0,55.0,Male,British,,,I26.9 Pulmonary embolism without mention of acute cor pulmonale|I80.2 Phlebitis and thrombophlebitis of other deep vessels of lower extremities|K44.9 Diaphragmatic hernia without obstruction or gangrene|L57.5 Actinic granuloma|R07.3 Other chest pain|Z86.7 Personal history of diseases of the circulatory system,I80.2 Phlebitis and thrombophlebitis of other deep vessels of lower extremities|K44.9 Diaphragmatic hernia without obstruction or gangrene|L57.5 Actinic granuloma|R07.3 Other chest pain,I26.9 Pulmonary embolism without mention of acute cor pulmonale|Z86.7 Personal history of diseases of the circulatory system,deep venous thrombosis (dvt)|pulmonary embolism +/- dvt|hiatus hernia,,,1.52,,30.51,29.1,48.7,73.7,425.4,2.1,26.22,33.17,37.07,89.47,8.51,95.72,76.03,0.52,6.56,5.22,65.3,0.0,0.0,209.2,0.178,16.75,4.44,11.67,0.042,0.953,7.99,,"['4.04', '4.09']","['2.76', '2.7']"
3215929,chr12,6333823,G,A,missense_variant,MODERATE,TNFRSF1A,,6.922e-07,Pathogenic,ENST00000162749.7:c.236C>T,ENSP00000162749.2:p.Thr79Met,TNF receptor-associated periodic syndrome (TRAPS),142680,"Recurrent fever, serositis, rash, and ocular or joint inflammation","ALLELEID=27375;CLNDISDB=MedGen:C3661900|MONDO:MONDO:0007727,MedGen:C1275126,OMIM:142680,Orphanet:32960|MONDO:MONDO:0005301,MedGen:C0026769,Orphanet:802;CLNDN=not_provided|TNF_receptor-associated_periodic_fever_syndrome_(TRAPS)|Multiple_sclerosis;CLNHGVS=NC_000012.12:g.6333823G>A;CLNREVSTAT=criteria_provided,_multiple_submitters,_no_conflicts;CLNSIG=Pathogenic;CLNSIGSCV=SCV000490856|SCV000958864|SCV001448272|SCV001961330|SCV002072464|SCV002761858|SCV005420387;CLNVC=single_nucleotide_variant;CLNVCSO=SO:0001483;CLNVI=ClinGen:CA280147|OMIM:191190.0002|UniProtKB:P19438#VAR_013412;GENEINFO=TNFRSF1A:7132;MC=SO:0001583|missense_variant,SO:0001619|non-coding_transcript_variant,SO:0001623|5_prime_UTR_variant;ORIGIN=1;RS=104895219","criteria_provided,_multiple_submitters,_no_conflicts",0.488,SNV,GT:AD:AF:DP:F1R2:F2R1:SB,"0/1:38,38:0.488:76:15,12:21,21:17,21,19,19",1959.0,49.0,Female,British,,,"A41.9 Septicaemia, unspecified|C50.3 Lower-inner quadrant of breast|C50.9 Breast, unspecified|D05.1 Intraductal carcinoma in situ|D70 Agranulocytosis|E66.8 Other obesity|F32.9 Depressive episode, unspecified|H53.8 Other visual disturbances|J18.1 Lobar pneumonia, unspecified|J84.1 Other interstitial pulmonary diseases with fibrosis|K07.6 Temporomandibular joint disorders|M79.60 Pain in limb (Multiple sites)|M79.62 Pain in limb (Upper arm)|M79.82 Other specified soft tissue disorders (Upper arm)|R10.4 Other and unspecified abdominal pain|R32 Unspecified urinary incontinence|R50.9 Fever, unspecified|R51 Headache|R79.0 Abnormal level of blood mineral|T43.2 Other and unspecified antidepressants|X61.9 Unspecified place|Z03.8 Observation for other suspected diseases and conditions|Z30.2 Sterilisation|Z90.1 Acquired absence of breast(s)|Z91.5 Personal history of self-harm|Z92.3 Personal history of irradiation|Z92.6 Personal history of chemotherapy for neoplastic disease","A41.9 Septicaemia, unspecified|C50.3 Lower-inner quadrant of breast|J18.1 Lobar pneumonia, unspecified|M79.60 Pain in limb (Multiple sites)|M79.82 Other specified soft tissue disorders (Upper arm)|R10.4 Other and unspecified abdominal pain|R50.9 Fever, unspecified|T43.2 Other and unspecified antidepressants|Z30.2 Sterilisation","C50.3 Lower-inner quadrant of breast|C50.9 Breast, unspecified|D05.1 Intraductal carcinoma in situ|D70 Agranulocytosis|E66.8 Other obesity|F32.9 Depressive episode, unspecified|H53.8 Other visual disturbances|J84.1 Other interstitial pulmonary diseases with fibrosis|K07.6 Temporomandibular joint disorders|M79.62 Pain in limb (Upper arm)|R32 Unspecified urinary incontinence|R51 Headache|R79.0 Abnormal level of blood mineral|Z03.8 Observation for other suspected diseases and conditions|Z90.1 Acquired absence of breast(s)|Z91.5 Personal history of self-harm|Z92.3 Personal history of irradiation|Z92.6 Personal history of chemotherapy for neoplastic disease",depression|anorexia/bulimia/other eating disorder,,,2.24,,14.27,23.8,16.6,77.2,163.3,1.5,24.6,29.5,34.2,86.5,10.1,95.7,76.4,0.2,2.9,4.2,67.5,0.0,0.0,252.0,0.253,16.5,4.31,13.3,0.046,1.06,6.2,,"['2.92', '2.92', '2.86']","['2.27', '2.25', '2.24']"
3231074,chr17,16948752,G,C,stop_gained,HIGH,TNFRSF13B,4.599e-05,4.173e-05,Pathogenic,ENST00000261652.7:c.431C>G,ENSP00000261652.2:p.Ser144Ter,TACI deficiency,240500,Variable clinical expression,"ALLELEID=260152;CLNDISDB=MONDO:MONDO:0009413,MedGen:C3150354,OMIM:240500,Orphanet:1572|MedGen:CN169374|MedGen:C3661900|MONDO:MONDO:0011864,MedGen:C3149378,OMIM:607594,Orphanet:1572;CLNDN=Immunodeficiency,_common_variable,_2|not_specified|not_provided|Immunodeficiency,_common_variable,_1;CLNHGVS=NC_000017.11:g.16948752G>C;CLNREVSTAT=criteria_provided,_multiple_submitters,_no_conflicts;CLNSIG=Pathogenic;CLNSIGSCV=SCV000322127|SCV000831182|SCV001160601|SCV001250125|SCV005049847;CLNVC=single_nucleotide_variant;CLNVCSO=SO:0001483;CLNVI=ClinGen:CA8414017;GENEINFO=TNFRSF13B:23495;MC=SO:0001587|nonsense;ORIGIN=1;RS=104894650","criteria_provided,_multiple_submitters,_no_conflicts",0.486,SNV,GT:AD:AF:DP:F1R2:F2R1:SB,"0/1:42,35:0.486:77:16,15:16,14:25,17,21,14",1945.0,64.0,Female,British,2017-11-24,72.5,"A41.9 Septicaemia, unspecified|B96.8 Other specified bacterial agents as the cause of diseases classified to other chapters|C34.2 Middle lobe, bronchus or lung|C77.0 Lymph nodes of head, face and neck|C77.1 Intrathoracic lymph nodes|E04.1 Non-toxic single thyroid nodule|E55.9 Vitamin D deficiency, unspecified|F17.1 Harmful use|I08.1 Disorders of both mitral and tricuspid valves|I10 Essential (primary) hypertension|I26.9 Pulmonary embolism without mention of acute cor pulmonale|I50.0 Congestive heart failure|J18.9 Pneumonia, unspecified|J32.9 Chronic sinusitis, unspecified|J38.3 Other diseases of vocal cords|J40 Bronchitis, not specified as acute or chronic|J43.9 Emphysema, unspecified|J44.0 Chronic obstructive pulmonary disease with acute lower respiratory infection|J44.1 Chronic obstructive pulmonary disease with acute exacerbation, unspecified|J44.9 Chronic obstructive pulmonary disease, unspecified|M16.9 Coxarthrosis, unspecified|R06.0 Dyspnoea|R07.3 Other chest pain|R52.9 Pain, unspecified|Z02.8 Other examinations for administrative purposes|Z50.1 Other physical therapy|Z51.5 Palliative care|Z60.2 Living alone|Z72.0 Tobacco use|Z92.3 Personal history of irradiation|Z92.6 Personal history of chemotherapy for neoplastic disease","A41.9 Septicaemia, unspecified|C34.2 Middle lobe, bronchus or lung|I26.9 Pulmonary embolism without mention of acute cor pulmonale|J32.9 Chronic sinusitis, unspecified|J38.3 Other diseases of vocal cords|M16.9 Coxarthrosis, unspecified|R06.0 Dyspnoea|R07.3 Other chest pain","A41.9 Septicaemia, unspecified|B96.8 Other specified bacterial agents as the cause of diseases classified to other chapters|C34.2 Middle lobe, bronchus or lung|C77.0 Lymph nodes of head, face and neck|C77.1 Intrathoracic lymph nodes|E04.1 Non-toxic single thyroid nodule|E55.9 Vitamin D deficiency, unspecified|F17.1 Harmful use|I08.1 Disorders of both mitral and tricuspid valves|I10 Essential (primary) hypertension|I26.9 Pulmonary embolism without mention of acute cor pulmonale|I50.0 Congestive heart failure|J18.9 Pneumonia, unspecified|J40 Bronchitis, not specified as acute or chronic|J43.9 Emphysema, unspecified|J44.0 Chronic obstructive pulmonary disease with acute lower respiratory infection|J44.1 Chronic obstructive pulmonary disease with acute exacerbation, unspecified|J44.9 Chronic obstructive pulmonary disease, unspecified|M16.9 Coxarthrosis, unspecified|R52.9 Pain, unspecified|Z02.8 Other examinations for administrative purposes|Z50.1 Other physical therapy|Z51.5 Palliative care|Z60.2 Living alone|Z72.0 Tobacco use|Z92.3 Personal history of irradiation|Z92.6 Personal history of chemotherapy for neoplastic disease",hypertension|osteoarthritis,,,5.19,,12.57,20.0,47.9,107.4,300.9,3.11,23.53,32.74,34.82,94.03,7.78,103.31,84.55,0.6,4.57,9.23,69.9,0.0,0.0,292.3,0.227,15.62,4.283,13.77,0.059,1.369,13.2,"C34.9 Bronchus or lung, unspecified",,
3235216,chr17,16940378,G,T,stop_gained,HIGH,TNFRSF13B,4.6e-05,4.173e-05,Pathogenic,ENST00000261652.7:c.579C>A,ENSP00000261652.2:p.Cys193Ter,TACI deficiency,240500,Variable clinical expression,"ALLELEID=645329;CLNDISDB=MedGen:C3661900|MONDO:MONDO:0009413,MedGen:C3150354,OMIM:240500,Orphanet:1572;CLNDN=not_provided|Immunodeficiency,_common_variable,_2;CLNHGVS=NC_000017.11:g.16940378G>T;CLNREVSTAT=criteria_provided,_multiple_submitters,_no_conflicts;CLNSIG=Pathogenic;CLNSIGSCV=SCV000954281|SCV001151227;CLNVC=single_nucleotide_variant;CLNVCSO=SO:0001483;CLNVI=ClinGen:CA8413935;GENEINFO=TNFRSF13B:23495;MC=SO:0001587|nonsense;ORIGIN=1;RS=72553885","criteria_provided,_multiple_submitters,_no_conflicts",0.043,SNV,GT:AD:AF:DP:F1R2:F2R1:SB,"0/1:78,3:0.043:81:22,1:31,1:38,40,1,2",1958.0,50.0,Female,British,,,"C50.4 Upper-outer quadrant of breast|C77.3 Axillary and upper limb lymph nodes|D70 Agranulocytosis|M79.66 Pain in limb (Lower leg)|R25.2 Cramp and spasm|T80.2 Infections following infusion, transfusion and therapeutic injection|Y43.3 Other antineoplastic drugs|Z53.0 Procedure not carried out because of contraindication|Z85.3 Personal history of malignant neoplasm of breast",C50.4 Upper-outer quadrant of breast|R25.2 Cramp and spasm,"C77.3 Axillary and upper limb lymph nodes|D70 Agranulocytosis|M79.66 Pain in limb (Lower leg)|T80.2 Infections following infusion, transfusion and therapeutic injection|Z53.0 Procedure not carried out because of contraindication|Z85.3 Personal history of malignant neoplasm of breast",,breast cancer,['1999'],1.8,,12.28,21.8,12.1,54.7,343.2,1.71,29.81,32.87,33.83,97.17,9.13,112.64,91.09,0.46,7.98,3.36,58.4,0.0,0.0,235.1,0.214,16.24,4.043,14.56,0.048,1.181,5.75,,"['3.63', '3.54', '3.22']","['2.89', '2.85', '2.75']"
3238999,chr20,63687765,G,T,missense_variant,MODERATE,RTEL1,6.568e-06,2.112e-05,Pathogenic/Likely_pathogenic,ENST00000360203.11:c.1476G>T,ENSP00000353332.5:p.Met492Ile,DKCA4,616373,"Bone marrow failure, pulmonary and hepatic fibrosis, nail dystrophy, leukoplakia, reticulate skin pigmentation; microcephaly, neurodevelopmental delay","AF_ESP=8e-05;AF_EXAC=6e-05;ALLELEID=51187;CLNDISDB=MONDO:MONDO:0014076,MedGen:C3554656,OMIM:615190|MONDO:MONDO:0014613,MedGen:C4225346,OMIM:616373,Orphanet:2032|MedGen:C3661900|MONDO:MONDO:0015780,MedGen:C0265965,OMIM:PS127550,Orphanet:1775;CLNDN=Dyskeratosis_congenita,_autosomal_recessive_5|Pulmonary_fibrosis_and/or_bone_marrow_failure,_Telomere-related,_3|not_provided|Dyskeratosis_congenita;CLNHGVS=NC_000020.11:g.63687765G>T;CLNREVSTAT=criteria_provided,_multiple_submitters,_no_conflicts;CLNSIG=Pathogenic/Likely_pathogenic;CLNSIGSCV=SCV000699742|SCV000964946|SCV003812007|SCV004169101|SCV004209343;CLNVC=single_nucleotide_variant;CLNVCSO=SO:0001483;CLNVI=ClinGen:CA130949|OMIM:608833.0003;GENEINFO=RTEL1:51750|RTEL1-TNFRSF6B:100533107;MC=SO:0001583|missense_variant,SO:0001619|non-coding_transcript_variant;ORIGIN=1;RS=370343781","criteria_provided,_multiple_submitters,_no_conflicts",0.5,SNV,GT:AD:AF:DP:F1R2:F2R1:SB,"0/1:40,38:0.5:78:21,13:13,20:24,16,18,20",1941.0,67.0,Female,Any other white background,,,"E78.0 Pure hypercholesterolaemia|E78.5 Hyperlipidaemia, unspecified|F00.9 Dementia in Alzheimer's disease, unspecified|F01.9 Vascular dementia, unspecified|G30.9 Alzheimer's disease, unspecified|H18.1 Bullous keratopathy|H18.4 Corneal degeneration|H25.1 Senile nuclear cataract|H27.0 Aphakia|H40.0 Glaucoma suspect|H40.5 Glaucoma secondary to other eye disorders|H40.9 Glaucoma, unspecified|I10 Essential (primary) hypertension|I26.9 Pulmonary embolism without mention of acute cor pulmonale|J45.9 Asthma, unspecified|M17.0 Primary gonarthrosis, bilateral|M17.1 Other primary gonarthrosis|M47.9 Spondylosis, unspecified|M48.0 Spinal stenosis|M48.06 Spinal stenosis (Lumbar region)|M48.09 Spinal stenosis (Site unspecified)|M51.3 Other specified intervertebral disk degeneration|M81.9 Osteoporosis, unspecified|R25.1 Tremor, unspecified|R26.3 Immobility|R32 Unspecified urinary incontinence|R50.9 Fever, unspecified|R69 Unknown and unspecified causes of morbidity|R79.8 Other specified abnormal findings of blood chemistry|R82.8 Abnormal findings on cytological and histological examination of urine|S00.0 Superficial injury of scalp|S72.0 Fracture of neck of femur|W18.9 Unspecified place|Z51.2 Other chemotherapy|Z86.7 Personal history of diseases of the circulatory system|Z87.3 Personal history of diseases of the musculoskeletal system and connective tissue|Z88.0 Personal history of allergy to penicillin|Z88.1 Personal history of allergy to other antibiotic agents|Z92.1 Personal history of long-term (current) use of anticoagulants|Z96.6 Presence of orthopaedic joint implants|Z97.4 Presence of external hearing-aid","H18.4 Corneal degeneration|H25.1 Senile nuclear cataract|I26.9 Pulmonary embolism without mention of acute cor pulmonale|M17.0 Primary gonarthrosis, bilateral|M17.1 Other primary gonarthrosis|M48.06 Spinal stenosis (Lumbar region)|M51.3 Other specified intervertebral disk degeneration|R50.9 Fever, unspecified|R69 Unknown and unspecified causes of morbidity|S00.0 Superficial injury of scalp|S72.0 Fracture of neck of femur","E78.0 Pure hypercholesterolaemia|E78.5 Hyperlipidaemia, unspecified|F00.9 Dementia in Alzheimer's disease, unspecified|F01.9 Vascular dementia, unspecified|G30.9 Alzheimer's disease, unspecified|H18.1 Bullous keratopathy|H27.0 Aphakia|H40.0 Glaucoma suspect|H40.5 Glaucoma secondary to other eye disorders|H40.9 Glaucoma, unspecified|I10 Essential (primary) hypertension|J45.9 Asthma, unspecified|M47.9 Spondylosis, unspecified|M48.0 Spinal stenosis|M48.06 Spinal stenosis (Lumbar region)|M48.09 Spinal stenosis (Site unspecified)|M51.3 Other specified intervertebral disk degeneration|M81.9 Osteoporosis, unspecified|R25.1 Tremor, unspecified|R26.3 Immobility|R32 Unspecified urinary incontinence|R79.8 Other specified abnormal findings of blood chemistry|R82.8 Abnormal findings on cytological and histological examination of urine|Z51.2 Other chemotherapy|Z86.7 Personal history of diseases of the circulatory system|Z87.3 Personal history of diseases of the musculoskeletal system and connective tissue|Z88.0 Personal history of allergy to penicillin|Z88.1 Personal history of allergy to other antibiotic agents|Z92.1 Personal history of long-term (current) use of anticoagulants|Z96.6 Presence of orthopaedic joint implants|Z97.4 Presence of external hearing-aid",glaucoma|connective tissue disorder|retinal detachment|high cholesterol,,,0.63,,9.81,30.4,36.4,70.6,234.4,3.03,38.39,28.99,32.85,88.26,8.05,124.62,89.85,0.52,6.56,4.08,51.6,0.0,0.0,370.7,0.298,15.99,4.522,14.99,0.046,1.023,7.9,,,
