4403775,chr15,77031225,G,A,missense_variant,MODERATE,PSTPIP1,,6.846e-07,Pathogenic,ENST00000558012.6:c.688G>A,ENSP00000452746.1:p.Ala230Thr,"Pyogenic sterile arthritis, pyoderma gangrenosum, acne (PAPA) syndrome, hyperzincemia and hypercalprotectinemia",604416,"Destructive arthritis, inflammatory skin rash, myositis","ALLELEID=19474;CLNDISDB=.|MONDO:MONDO:0011462,MedGen:C1858361,OMIM:604416,Orphanet:69126|MedGen:C3661900;CLNDN=PSTPIP1-related_disorder|Pyogenic_arthritis-pyoderma_gangrenosum-acne_syndrome|not_provided;CLNHGVS=NC_000015.10:g.77031225G>A;CLNREVSTAT=criteria_provided,_multiple_submitters,_no_conflicts;CLNSIG=Pathogenic;CLNSIGSCV=SCV000514293|SCV000820801|SCV001468468|SCV001501086|SCV004030486|SCV004108050;CLNVC=single_nucleotide_variant;CLNVCSO=SO:0001483;CLNVI=ClinGen:CA116855|OMIM:606347.0002|UniProtKB:O43586#VAR_023522;GENEINFO=PSTPIP1:9051;MC=SO:0001583|missense_variant,SO:0001619|non-coding_transcript_variant;ORIGIN=1;RS=121908130","criteria_provided,_multiple_submitters,_no_conflicts",0.423,SNV,GT:AD:AF:DP:F1R2:F2R1:SB,"0/1:39,23:0.423:62:15,13:12,8:21,18,17,6",1964.0,43.0,Female,Pakistani,,,"B96.2 Escherichia coli [E. coli] as the cause of diseases classified to other chapters|E03.9 Hypothyroidism, unspecified|E85.4 Organ-limited amyloidosis|E87.2 Acidosis|G90.9 Disorder of autonomic nervous system, unspecified|I43.1 Cardiomyopathy in metabolic diseases|I44.3 Other and unspecified atrioventricular block|I47.2 Ventricular tachycardia|I50.0 Congestive heart failure|I83.9 Varicose veins of lower extremities without ulcer or inflammation|R79.8 Other specified abnormal findings of blood chemistry|R87.6 Abnormal cytological findings|T81.4 Infection following a procedure, not elsewhere classified|T86.2 Heart transplant failure and rejection|Z08.0 Follow-up examination after surgery for malignant neoplasm|Z09.0 Follow-up examination after surgery for other conditions|Z11.5 Special screening examination for other viral diseases|Z13.6 Special screening examination for cardiovascular disorders|Z48.0 Attention to surgical dressings and sutures|Z82.4 Family history of ischaemic heart disease and other diseases of the circulatory system|Z86.1 Personal history of infectious and parasitic diseases|Z86.7 Personal history of diseases of the circulatory system|Z87.4 Personal history of diseases of the genito-urinary system|Z88.6 Personal history of allergy to analgesic agent|Z92.2 Personal history of long-term (current) use of other medicaments|Z94.1 Heart transplant status|Z95.0 Presence of cardiac pacemaker",E85.4 Organ-limited amyloidosis|I50.0 Congestive heart failure|I83.9 Varicose veins of lower extremities without ulcer or inflammation|R87.6 Abnormal cytological findings|T86.2 Heart transplant failure and rejection|Z08.0 Follow-up examination after surgery for malignant neoplasm|Z09.0 Follow-up examination after surgery for other conditions,"B96.2 Escherichia coli [E. coli] as the cause of diseases classified to other chapters|E03.9 Hypothyroidism, unspecified|E85.4 Organ-limited amyloidosis|E87.2 Acidosis|G90.9 Disorder of autonomic nervous system, unspecified|I43.1 Cardiomyopathy in metabolic diseases|I44.3 Other and unspecified atrioventricular block|I47.2 Ventricular tachycardia|I50.0 Congestive heart failure|R79.8 Other specified abnormal findings of blood chemistry|T81.4 Infection following a procedure, not elsewhere classified|Z11.5 Special screening examination for other viral diseases|Z13.6 Special screening examination for cardiovascular disorders|Z48.0 Attention to surgical dressings and sutures|Z82.4 Family history of ischaemic heart disease and other diseases of the circulatory system|Z86.1 Personal history of infectious and parasitic diseases|Z86.7 Personal history of diseases of the circulatory system|Z87.4 Personal history of diseases of the genito-urinary system|Z88.6 Personal history of allergy to analgesic agent|Z92.2 Personal history of long-term (current) use of other medicaments|Z94.1 Heart transplant status|Z95.0 Presence of cardiac pacemaker",hypothyroidism/myxoedema,,,0.09,44.3,8.21,18.0,19.0,68.4,250.4,1.2,29.7,32.5,34.5,94.1,8.7,112.1,92.0,0.2,4.4,2.6,64.0,0.0,0.0,246.0,0.214,16.3,3.65,12.9,0.031,0.86,4.1,,"['3.11', '3.07', '2.78']","['2.5', '2.46', '2.51']"
4415843,chr12,49026430,C,T,missense_variant,MODERATE,KMT2D,,1.368e-06,Pathogenic/Likely_pathogenic,ENST00000301067.12:c.15536G>A,ENSP00000301067.7:p.Arg5179His,Kabuki Syndrome 1 due to KMT2D deficiency,147920,"Typical facial abnormalities, cleft or high arched palate, skeletal abnormalities, short stature, intellectual disability, congenital heart defects, recurrent infections (otitis media, pneumonia) in 50% of patients. Autoimmunity may be present","ALLELEID=22575;CLNDISDB=MedGen:C3661900|MONDO:MONDO:0007843,MedGen:CN030661,OMIM:147920,Orphanet:2322|MONDO:MONDO:0016512,MedGen:C0796004,OMIM:PS147920,Orphanet:2322;CLNDN=not_provided|Kabuki_syndrome_1|Kabuki_syndrome;CLNHGVS=NC_000012.12:g.49026430C>T;CLNREVSTAT=criteria_provided,_multiple_submitters,_no_conflicts;CLNSIG=Pathogenic/Likely_pathogenic;CLNSIGSCV=SCV000230781|SCV000781686|SCV001207392|SCV004171249|SCV005400514;CLNVC=single_nucleotide_variant;CLNVCSO=SO:0001483;CLNVI=ClinGen:CA254197|OMIM:602113.0001|UniProtKB:O14686#VAR_063831;GENEINFO=KMT2D:8085;MC=SO:0001583|missense_variant;ORIGIN=33;RS=267607237","criteria_provided,_multiple_submitters,_no_conflicts",0.047,SNV,GT:AD:AF:DP:F1R2:F2R1:SB,"0/1:72,3:0.047:75:28,1:29,1:41,31,2,1",1948.0,62.0,Male,British,,,"C61 Malignant neoplasm of prostate|I10 Essential (primary) hypertension|M19.07 Primary arthrosis of other joints (Ankle and foot)|M19.9 Arthrosis, unspecified|M24.4 Recurrent dislocation and subluxation of joint|M75.1 Rotator cuff syndrome|M75.4 Impingement syndrome of shoulder|N50.8 Other specified disorders of male genital organs|T81.8 Other complications of procedures, not elsewhere classified|Y83.8 Other surgical procedures|Z53.8 Procedure not carried out for other reasons|Z86.4 Personal history of psychoactive substance abuse","C61 Malignant neoplasm of prostate|M19.07 Primary arthrosis of other joints (Ankle and foot)|M19.9 Arthrosis, unspecified|M75.1 Rotator cuff syndrome|T81.8 Other complications of procedures, not elsewhere classified",I10 Essential (primary) hypertension|M24.4 Recurrent dislocation and subluxation of joint|M75.4 Impingement syndrome of shoulder|N50.8 Other specified disorders of male genital organs|Z53.8 Procedure not carried out for other reasons|Z86.4 Personal history of psychoactive substance abuse,hypertension,,,2.59,,21.47,35.7,46.9,80.5,428.9,1.98,29.26,34.26,34.43,99.51,8.84,115.23,90.92,0.63,9.3,4.03,59.5,0.0,0.0,273.4,0.241,15.72,4.567,13.52,0.046,1.012,6.77,,,
4433476,chr17,16948752,G,C,stop_gained,HIGH,TNFRSF13B,4.599e-05,4.173e-05,Pathogenic,ENST00000261652.7:c.431C>G,ENSP00000261652.2:p.Ser144Ter,TACI deficiency,240500,Variable clinical expression,"ALLELEID=260152;CLNDISDB=MONDO:MONDO:0009413,MedGen:C3150354,OMIM:240500,Orphanet:1572|MedGen:CN169374|MedGen:C3661900|MONDO:MONDO:0011864,MedGen:C3149378,OMIM:607594,Orphanet:1572;CLNDN=Immunodeficiency,_common_variable,_2|not_specified|not_provided|Immunodeficiency,_common_variable,_1;CLNHGVS=NC_000017.11:g.16948752G>C;CLNREVSTAT=criteria_provided,_multiple_submitters,_no_conflicts;CLNSIG=Pathogenic;CLNSIGSCV=SCV000322127|SCV000831182|SCV001160601|SCV001250125|SCV005049847;CLNVC=single_nucleotide_variant;CLNVCSO=SO:0001483;CLNVI=ClinGen:CA8414017;GENEINFO=TNFRSF13B:23495;MC=SO:0001587|nonsense;ORIGIN=1;RS=104894650","criteria_provided,_multiple_submitters,_no_conflicts",0.508,SNV,GT:AD:AF:DP:F1R2:F2R1:SB,"0/1:35,37:0.508:72:17,15:11,16:26,9,23,14",1957.0,51.0,Female,British,,,"D06.9 Cervix, unspecified|E03.9 Hypothyroidism, unspecified|F31.0 Bipolar affective disorder, current episode hypomanic|F31.2 Bipolar affective disorder, current episode manic with psychotic symptoms|K12.1 Other forms of stomatitis|Z63.1 Problems in relationship with parents and in-laws|Z86.0 Personal history of other neoplasms|Z86.4 Personal history of psychoactive substance abuse","D06.9 Cervix, unspecified|F31.0 Bipolar affective disorder, current episode hypomanic|F31.2 Bipolar affective disorder, current episode manic with psychotic symptoms|K12.1 Other forms of stomatitis","E03.9 Hypothyroidism, unspecified|Z63.1 Problems in relationship with parents and in-laws|Z86.0 Personal history of other neoplasms|Z86.4 Personal history of psychoactive substance abuse",hypothyroidism/myxoedema|allergy/hypersensitivity/anaphylaxis,,,1.94,,15.74,23.8,40.1,101.5,317.7,1.9,25.5,30.4,32.8,92.8,9.5,101.7,79.9,0.6,7.6,4.6,63.4,0.0,0.0,262.0,0.248,17.0,4.45,13.2,0.096,2.16,7.3,,"['3.96', '3.9', '3.57']","['3.12', '2.99', '2.49']"
4439640,chr2,162272377,C,T,missense_variant,MODERATE,IFIH1,,9.59e-06,Pathogenic/Likely_pathogenic,ENST00000649979.2:c.2465G>A,ENSP00000497271.1:p.Arg822Gln,Aicardi-Goutieres syndrome 7 (AGS7),615846,"Classical AGS, SLE, SP, SMS","AF_ESP=8e-05;AF_EXAC=3e-05;ALLELEID=187227;CLNDISDB=MONDO:MONDO:0024535,MedGen:C4225427,OMIM:182250,Orphanet:85191|MedGen:C3661900|.|MONDO:MONDO:0014367,MedGen:C3888244,OMIM:615846,Orphanet:51;CLNDN=Singleton-Merten_syndrome_1|not_provided|IFIH1-related_disorder|Aicardi-Goutieres_syndrome_7;CLNHGVS=NC_000002.12:g.162272377C>T;CLNREVSTAT=criteria_provided,_multiple_submitters,_no_conflicts;CLNSIG=Pathogenic/Likely_pathogenic;CLNSIGSCV=SCV000517315|SCV000927411|SCV000928386|SCV000963109|SCV001500236|SCV001905612|SCV002023125|SCV004013774|SCV004026003|SCV004026603|SCV005387896;CLNVC=single_nucleotide_variant;CLNVCSO=SO:0001483;CLNVI=ClinGen:CA199234|OMIM:606951.0009|UniProtKB:Q9BYX4#VAR_073666;GENEINFO=IFIH1:64135;MC=SO:0001583|missense_variant;ORIGIN=9;RS=376048533","criteria_provided,_multiple_submitters,_no_conflicts",0.353,SNV,GT:AD:AF:DP:F1R2:F2R1:SB,"0/1:25,13:0.353:38:7,3:8,5:9,16,3,10",1964.0,43.0,Female,British,,,N70.1 Chronic salpingitis and oophoritis|N73.6 Female pelvic peritoneal adhesions|N97.1 Female infertility of tubal origin|R10.4 Other and unspecified abdominal pain|R63.4 Abnormal weight loss,N97.1 Female infertility of tubal origin|R10.4 Other and unspecified abdominal pain,N70.1 Chronic salpingitis and oophoritis|N73.6 Female pelvic peritoneal adhesions|R63.4 Abnormal weight loss,hayfever/allergic rhinitis,,,0.94,,12.15,20.7,10.9,57.9,211.3,2.0,29.6,30.0,33.3,90.0,9.3,118.4,86.5,0.5,7.2,3.7,56.2,0.0,0.0,250.0,0.231,16.4,4.32,14.4,0.025,0.58,6.7,,"['2.73', '2.7', '2.51']","['2.23', '2.22', '2.12']"
4508985,chr16,50711670,C,T,missense_variant,MODERATE,NOD2,,1.78e-05,Pathogenic/Likely_pathogenic,ENST00000647318.2:c.1678C>T,ENSP00000495993.1:p.Arg560Cys,Blau syndrome,186580,"Uveitis, granulomatous synovitis, camptodactyly, rash and cranial neuropathies, 30% develop Crohn colitis","ALLELEID=103730;CLNDISDB=MedGen:C3661900|MeSH:D003424,MedGen:C0678202|MONDO:MONDO:0008523,MedGen:C5201146,OMIM:186580,Orphanet:90340;CLNDN=not_provided|Regional_enteritis|Blau_syndrome;CLNHGVS=NC_000016.10:g.50711670C>T;CLNREVSTAT=criteria_provided,_multiple_submitters,_no_conflicts;CLNSIG=Pathogenic/Likely_pathogenic;CLNSIGSCV=SCV001249670|SCV003443516;CLNVC=single_nucleotide_variant;CLNVCSO=SO:0001483;CLNVI=ClinGen:CA150228|UniProtKB:Q9HC29#VAR_073240;GENEINFO=NOD2:64127;MC=SO:0001583|missense_variant,SO:0001619|non-coding_transcript_variant;ORIGIN=1;RS=104895479","criteria_provided,_multiple_submitters,_no_conflicts",0.055,SNV,GT:AD:AF:DP:F1R2:F2R1:SB,"0/1:76,3:0.055:79:30,1:35,2:37,39,1,2",1961.0,47.0,Female,British,,,O20.0 Threatened abortion,O20.0 Threatened abortion,,,,,0.26,,10.31,16.2,12.4,79.4,228.1,1.86,26.2,31.26,34.49,90.65,9.62,109.52,82.63,0.48,6.8,4.48,63.0,0.0,0.0,233.0,0.224,16.69,4.406,13.34,0.049,1.121,7.11,,"['3.5', '3.39', '3.42', '3.28']","['2.82', '2.74', '2.67', '2.57']"
4552058,chr11,118473470,AC,A,frameshift_variant,HIGH,KMT2A,,0.0,Pathogenic,ENST00000534358.8:c.2318del,ENSP00000436786.2:p.Pro773ArgfsTer8,Widemann-Steiner syndrome,605130,"Respiratory infections, short stature, hypertelorism, hairy elbows, developmental delay, intellectual disability","ALLELEID=511887;CLNDISDB=MeSH:D030342,MedGen:C0950123|MedGen:C3661900|MONDO:MONDO:0011518,MedGen:C1854630,OMIM:605130,Orphanet:319182;CLNDN=Inborn_genetic_diseases|not_provided|Wiedemann-Steiner_syndrome;CLNHGVS=NC_000011.10:g.118473477del;CLNREVSTAT=criteria_provided,_multiple_submitters,_no_conflicts;CLNSIG=Pathogenic;CLNSIGSCV=SCV000743051|SCV002521648|SCV004538988;CLNVC=Deletion;CLNVCSO=SO:0000159;CLNVI=ClinGen:CA477358062;GENEINFO=KMT2A:4297;MC=SO:0001589|frameshift_variant;ORIGIN=1;RS=782297546","criteria_provided,_multiple_submitters,_no_conflicts",0.097,deletion,GT:AD:AF:DP:F1R2:F2R1:SB,"0/1:46,4:0.097:50:16,2:14,2:20,26,0,4",1961.0,48.0,Female,British,,,,,,,,,0.15,,9.27,19.3,16.0,66.1,172.9,1.23,31.59,28.17,33.86,83.18,9.4,106.42,79.12,0.47,12.03,1.87,48.1,0.0,0.0,170.5,0.16,17.03,4.383,13.39,0.025,0.581,3.89,,"['4.93', '4.87', '4.63']","['3.72', '3.69', '3.52']"
4575522,chr10,87933160,T,C,missense_variant,MODERATE,PTEN,,6.841e-07,Pathogenic/Likely_pathogenic,ENST00000371953.8:c.401T>C,ENSP00000361021.3:p.Met134Thr,PTEN Deficiency (LOF),158350,"Recurrent infections, Lymphoproliferation, Autoimmunity; developmental delay","ALLELEID=416941;CLNDISDB=MONDO:MONDO:0015356,MeSH:D009386,MedGen:C0027672,Orphanet:140162|MONDO:MONDO:0017623,MeSH:D006223,MedGen:C1959582,Orphanet:306498|MONDO:MONDO:0008021,MedGen:CN072330,OMIM:158350;CLNDN=Hereditary_cancer-predisposing_syndrome|PTEN_hamartoma_tumor_syndrome|Cowden_syndrome_1;CLNHGVS=NC_000010.11:g.87933160T>C;CLNREVSTAT=criteria_provided,_multiple_submitters,_no_conflicts;CLNSIG=Pathogenic/Likely_pathogenic;CLNSIGSCV=SCV000579272|SCV001183326|SCV003439626|SCV004188764;CLNVC=single_nucleotide_variant;CLNVCSO=SO:0001483;CLNVI=ClinGen:CA377482338;GENEINFO=PTEN:5728;MC=SO:0001583|missense_variant,SO:0001623|5_prime_UTR_variant;ORIGIN=17;RS=1085308046","criteria_provided,_multiple_submitters,_no_conflicts",0.509,SNV,GT:AD:AF:DP:F1R2:F2R1:SB,"0/1:24,24:0.509:48:12,8:8,11:8,16,11,13",1968.0,40.0,Male,British,,,K20 Oesophagitis|K21.0 Gastro-oesophageal reflux disease with oesophagitis|K44.9 Diaphragmatic hernia without obstruction or gangrene,K44.9 Diaphragmatic hernia without obstruction or gangrene,K20 Oesophagitis|K21.0 Gastro-oesophageal reflux disease with oesophagitis,hypertension|depression|hiatus hernia|liver/biliary/pancreas problem|retinal problem,,,2.08,,35.78,31.5,108.3,77.4,435.4,1.22,24.74,30.15,33.33,90.45,7.49,97.81,77.08,0.35,6.98,3.3,66.9,0.0,0.0,343.7,0.257,16.21,4.805,12.9,0.114,2.38,4.94,,"['3.64', '3.62', '3.28']","['3.02', '3.0', '2.57']"
4582050,chr10,87925543,C,A,stop_gained,HIGH,PTEN,,6.993e-07,Pathogenic,ENST00000371953.8:c.195C>A,ENSP00000361021.3:p.Tyr65Ter,PTEN Deficiency (LOF),158350,"Recurrent infections, Lymphoproliferation, Autoimmunity; developmental delay","ALLELEID=419704;CLNDISDB=MONDO:MONDO:0015356,MeSH:D009386,MedGen:C0027672,Orphanet:140162|MONDO:MONDO:0017623,MeSH:D006223,MedGen:C1959582,Orphanet:306498|MONDO:MONDO:0008021,MedGen:CN072330,OMIM:158350;CLNDN=Hereditary_cancer-predisposing_syndrome|PTEN_hamartoma_tumor_syndrome|Cowden_syndrome_1;CLNHGVS=NC_000010.11:g.87925543C>A;CLNREVSTAT=criteria_provided,_multiple_submitters,_no_conflicts;CLNSIG=Pathogenic;CLNSIGSCV=SCV000580064|SCV002243012|SCV004188860|SCV004848189;CLNVC=single_nucleotide_variant;CLNVCSO=SO:0001483;CLNVI=ClinGen:CA377785045;GENEINFO=PTEN:5728;MC=SO:0001587|nonsense,SO:0001627|intron_variant;ORIGIN=1;RS=878853936","criteria_provided,_multiple_submitters,_no_conflicts",0.11,SNV,GT:AD:AF:DP:F1R2:F2R1:SB,"0/1:29,4:0.11:33:10,1:12,1:16,13,2,2",1953.0,55.0,Female,British,,,"K20 Oesophagitis|K80.2 Calculus of gallbladder without cholecystitis|M17.9 Gonarthrosis, unspecified|M19.99 Arthrosis, unspecified (Site unspecified)|M20.1 Hallux valgus (acquired)|N92.0 Excessive and frequent menstruation with regular cycle|Z51.4 Preparatory care for treatment, not elsewhere classified","K80.2 Calculus of gallbladder without cholecystitis|M17.9 Gonarthrosis, unspecified|M20.1 Hallux valgus (acquired)|N92.0 Excessive and frequent menstruation with regular cycle","K20 Oesophagitis|M19.99 Arthrosis, unspecified (Site unspecified)|Z51.4 Preparatory care for treatment, not elsewhere classified",,,,1.47,,11.94,20.4,21.0,74.3,295.6,2.72,36.65,31.04,34.21,90.74,7.81,99.87,80.29,0.85,11.41,3.56,48.0,0.0,0.0,387.4,0.302,16.05,4.654,13.95,0.074,1.59,7.42,,"['2.78', '2.57', '2.2', '2.41', '2.45']","['2.29', '2.15', '2.2', '1.93', '1.87']"
4605932,chr17,28534361,C,T,missense_variant,MODERATE,FOXN1,6.572e-06,2.736e-06,Pathogenic,ENST00000579795.6:c.958C>T,ENSP00000464645.1:p.Arg320Trp,FOXN1 Haplosufficiency,618806,"Recurrent, viral and bacterial respiratory tract infections; skin involvement (eczema, dermatitis), nail dystropyhy","ALLELEID=815776;CLNDISDB=.|MONDO:MONDO:0032928,MedGen:C5394133,OMIM:618806,Orphanet:676039|MONDO:MONDO:0011132,MedGen:C1866426,OMIM:601705,Orphanet:169095;CLNDN=T-CELL_LYMPHOPENIA,_INFANTILE,_WITHOUT_NAIL_DYSTROPHY,_AUTOSOMAL_DOMINANT|T-cell_lymphopenia,_infantile,_with_or_without_nail_dystrophy,_autosomal_dominant|T-cell_immunodeficiency,_congenital_alopecia,_and_nail_dystrophy;CLNHGVS=NC_000017.11:g.28534361C>T;CLNREVSTAT=reviewed_by_expert_panel;CLNSIG=Pathogenic;CLNSIGSCV=SCV005382678;CLNVC=single_nucleotide_variant;CLNVCSO=SO:0001483;CLNVI=ClinGen:CA398324484|OMIM:600838.0002;GENEINFO=FOXN1:8456;MC=SO:0001583|missense_variant;ORIGIN=1;RS=1288977950",reviewed_by_expert_panel,0.057,SNV,GT:AD:AF:DP:F1R2:F2R1:SB,"0/1:49,3:0.057:52:26,1:21,1:24,25,1,2",1947.0,60.0,Male,British,,,"C01 Malignant neoplasm of base of tongue|C10.9 Oropharynx, unspecified|C77.0 Lymph nodes of head, face and neck|E11.9 Without complications|E78.0 Pure hypercholesterolaemia|I10 Essential (primary) hypertension|K14.8 Other diseases of tongue|K52.9 Non-infective gastro-enteritis and colitis, unspecified|L30.9 Dermatitis, unspecified|L92.9 Granulomatous disorder of skin and subcutaneous tissue, unspecified|Z92.2 Personal history of long-term (current) use of other medicaments","C01 Malignant neoplasm of base of tongue|K14.8 Other diseases of tongue|K52.9 Non-infective gastro-enteritis and colitis, unspecified|L92.9 Granulomatous disorder of skin and subcutaneous tissue, unspecified","C10.9 Oropharynx, unspecified|C77.0 Lymph nodes of head, face and neck|E11.9 Without complications|E78.0 Pure hypercholesterolaemia|I10 Essential (primary) hypertension|L30.9 Dermatitis, unspecified|Z92.2 Personal history of long-term (current) use of other medicaments",hypertension|gout|migraine|high cholesterol,,,1.14,,12.65,21.2,57.7,61.4,490.5,2.2,27.4,32.2,36.1,89.1,9.6,99.0,84.7,0.5,6.0,5.3,65.1,0.0,0.0,231.0,0.222,16.2,4.49,13.3,0.051,1.13,8.1,,"['4.59', '4.01', '4.47', '3.72', '3.5', '0.42']","['3.47', '3.32', '2.48', '2.78', '2.49', '0.41']"
4635654,chr12,49039611,G,A,stop_gained,HIGH,KMT2D,,6.871e-07,Pathogenic/Likely_pathogenic,ENST00000301067.12:c.8053C>T,ENSP00000301067.7:p.Arg2685Ter,Kabuki Syndrome 1 due to KMT2D deficiency,147920,"Typical facial abnormalities, cleft or high arched palate, skeletal abnormalities, short stature, intellectual disability, congenital heart defects, recurrent infections (otitis media, pneumonia) in 50% of patients. Autoimmunity may be present","ALLELEID=168936;CLNDISDB=MedGen:C3661900|MONDO:MONDO:0007843,MedGen:CN030661,OMIM:147920,Orphanet:2322;CLNDN=not_provided|Kabuki_syndrome_1;CLNHGVS=NC_000012.12:g.49039611G>A;CLNREVSTAT=criteria_provided,_multiple_submitters,_no_conflicts;CLNSIG=Pathogenic/Likely_pathogenic;CLNSIGSCV=SCV000193479|SCV000781610|SCV005079255;CLNVC=single_nucleotide_variant;CLNVCSO=SO:0001483;CLNVI=ClinGen:CA271659;GENEINFO=KMT2D:8085;MC=SO:0001587|nonsense;ORIGIN=1;RS=587783727","criteria_provided,_multiple_submitters,_no_conflicts",0.059,SNV,GT:AD:AF:DP:F1R2:F2R1:SB,"0/1:61,3:0.059:64:21,1:23,1:28,33,2,1",1954.0,55.0,Female,British,,,"E03.9 Hypothyroidism, unspecified|M23.30 Other meniscus derangements (Multiple sites)",M23.30 Other meniscus derangements (Multiple sites),"E03.9 Hypothyroidism, unspecified",hypothyroidism/myxoedema,,,5.02,,17.63,22.2,22.7,101.3,326.8,1.94,30.94,29.84,33.34,89.5,9.13,103.53,84.06,0.53,8.54,3.46,55.2,0.0,0.0,236.9,0.216,16.29,4.492,14.55,0.064,1.418,6.26,,"['3.45', '3.42']","['2.93', '2.9']"
4676988,chr1,9726972,G,A,missense_variant,MODERATE,PIK3CD,,6.841e-07,Pathogenic,ENST00000377346.9:c.3061G>A,ENSP00000366563.4:p.Glu1021Lys,PIK3CD mutation (GOF) APDS1,615513,"Severe bacterial infections, EBV  CMV viremia, autoimmunity, lymphadenopathy/splenomegaly,lymphoproliferation, lymphoma","ALLELEID=94255;CLNDISDB=MONDO:MONDO:0014222,MedGen:C3714976,OMIM:615513,Orphanet:397596|MedGen:C3661900|MeSH:D030342,MedGen:C0950123|MONDO:MONDO:0013226,MedGen:C2750068,OMIM:613328,Orphanet:221139|MONDO:MONDO:0023655,MedGen:C5543301,OMIM:619281|MeSH:D000081207,MedGen:C5197805;CLNDN=Immunodeficiency_14|not_provided|Inborn_genetic_diseases|Combined_immunodeficiency_with_faciooculoskeletal_anomalies|Immunodeficiency_14b,_autosomal_recessive|Inherited_Immunodeficiency_Diseases;CLNHGVS=NC_000001.11:g.9726972G>A;CLNREVSTAT=criteria_provided,_multiple_submitters,_no_conflicts;CLNSIG=Pathogenic;CLNSIGSCV=SCV000281454|SCV000329467|SCV000598124|SCV000604662|SCV000653771|SCV000803590|SCV000927492|SCV001190182|SCV001446669|SCV001468433|SCV001499926|SCV001528326|SCV002318629|SCV002320833|SCV002543857|SCV003807405|SCV003920323|SCV005006182|SCV005442228;CLNVC=single_nucleotide_variant;CLNVCSO=SO:0001483;CLNVI=ClinGen:CA145460|OMIM:602839.0001|UniProtKB:O00329#VAR_070918;GENEINFO=PIK3CD:5293;MC=SO:0001583|missense_variant;ORIGIN=37;RS=397518423","criteria_provided,_multiple_submitters,_no_conflicts",0.073,SNV,GT:AD:AF:DP:F1R2:F2R1:SB,"0/1:51,3:0.073:54:18,2:26,1:27,24,2,1",1952.0,57.0,Female,British,,,"C43.5 Malignant melanoma of trunk|C44.5 Skin of trunk|D03.5 Melanoma in situ of trunk|D25.9 Leiomyoma of uterus, unspecified|N95.0 Postmenopausal bleeding|Z53.9 Procedure not carried out, unspecified reason|Z85.8 Personal history of malignant neoplasms of other organs and systems","C43.5 Malignant melanoma of trunk|C44.5 Skin of trunk|D03.5 Melanoma in situ of trunk|D25.9 Leiomyoma of uterus, unspecified","N95.0 Postmenopausal bleeding|Z53.9 Procedure not carried out, unspecified reason|Z85.8 Personal history of malignant neoplasms of other organs and systems",asthma|uterine fibroids,malignant melanoma,['56'],0.78,,12.39,19.4,20.2,88.7,223.9,3.28,40.25,29.66,33.35,88.94,9.77,104.6,82.91,0.67,8.18,4.06,49.8,0.0,0.0,251.1,0.245,16.2,4.43,13.36,0.037,0.827,8.15,,"['3.85', '4.02', '4.18']","['3.09', '2.79', '2.44']"
