Participant ID,CHROM,POS,REF,ALT,Consequence,IMPACT,SYMBOL,gnomADg_AF,gnomADe_AF,CLIN_SIG,HGVSc,HGVSp,Disease,OMIM,Associated_features,INFO,CLNREVSTAT,VAF,VARIANT_CLASS,FORMAT,FORMAT_INFO,Year of birth,Age at recruitment,Sex,Ethnic background,Date of death,Age at death,Diagnoses - ICD10,Diagnoses - main ICD10,Diagnoses - secondary ICD10,"Non-cancer illness code, self-reported","Cancer code, self-reported",Cancer year/age first occurred,C-reactive protein,Rheumatoid factor,Alanine aminotransferase,Aspartate aminotransferase,Gamma glutamyltransferase,Alkaline phosphatase,Urate,Lymphocyte count,Lymphocyte percentage,Mean corpuscular haemoglobin,Mean corpuscular haemoglobin concentration,Mean corpuscular volume,Mean platelet (thrombocyte) volume,Mean reticulocyte volume,Mean sphered cell volume,Monocyte count,Monocyte percentage,Neutrophill count,Neutrophill percentage,Nucleated red blood cell count,Nucleated red blood cell percentage,Platelet count,Platelet crit,Platelet distribution width,Red blood cell (erythrocyte) count,Red blood cell (erythrocyte) distribution width,Reticulocyte count,Reticulocyte percentage,White blood cell (leukocyte) count,Underlying (primary) cause of death: ICD10,Forced vital capacity (FVC),Forced expiratory volume in 1-second (FEV1)
1006432,chr5,1278781,C,T,missense_variant,MODERATE,TERT,,6.841e-07,Pathogenic/Likely_pathogenic,ENST00000310581.10:c.2146G>A,ENSP00000309572.5:p.Ala716Thr,DKCA2,614742| 613989,"Bone marrow failure, pulmonary and hepatic fibrosis, nail dystrophy, leukoplakia, reticulate skin pigmentation; microcephaly, neurodevelopmental delay","ALLELEID=45606;CLNDISDB=MONDO:MONDO:0013521,MedGen:C3151443,OMIM:613989|MeSH:D054990,MedGen:C1800706|MONDO:MONDO:0013878,MedGen:C3553617,OMIM:614742,Orphanet:88;CLNDN=Dyskeratosis_congenita,_autosomal_dominant_2|Idiopathic_Pulmonary_Fibrosis|Pulmonary_fibrosis_and/or_bone_marrow_failure,_Telomere-related,_1;CLNHGVS=NC_000005.10:g.1278781C>T;CLNREVSTAT=criteria_provided,_multiple_submitters,_no_conflicts;CLNSIG=Pathogenic/Likely_pathogenic;CLNSIGSCV=SCV000597466|SCV001429278|SCV003525636|SCV004175571;CLNVC=single_nucleotide_variant;CLNVCSO=SO:0001483;CLNVI=ClinGen:CA129984|OMIM:187270.0019|UniProtKB:O14746#VAR_068794;GENEINFO=TERT:7015;MC=SO:0001583|missense_variant,SO:0001619|non-coding_transcript_variant;ORIGIN=1;RS=387907249","criteria_provided,_multiple_submitters,_no_conflicts",0.075,SNV,GT:AD:AF:DP:F1R2:F2R1:SB,"0/1:43,4:0.075:47:23,1:12,1:20,23,2,2",1963.0,45.0,Male,British,,,C43.5 Malignant melanoma of trunk|D22.5 Melanocytic naevi of trunk|Z12.1 Special screening examination for neoplasm of intestinal tract|Z85.8 Personal history of malignant neoplasms of other organs and systems|Z88.0 Personal history of allergy to penicillin,C43.5 Malignant melanoma of trunk|D22.5 Melanocytic naevi of trunk|Z12.1 Special screening examination for neoplasm of intestinal tract,Z85.8 Personal history of malignant neoplasms of other organs and systems|Z88.0 Personal history of allergy to penicillin,,,,1.67,,25.59,24.6,20.6,56.9,263.8,2.23,35.04,33.02,35.74,92.41,9.49,104.16,78.81,0.46,7.17,3.57,56.0,0.0,0.0,270.2,0.256,15.93,4.71,13.16,0.036,0.76,6.37,,"['4.64', '4.42', '3.52']","['3.81', '3.65', '3.5']"
1011883,chr7,2947655,C,T,missense_variant,MODERATE,CARD11,,1.368e-06,Pathogenic/Likely_pathogenic,ENST00000396946.9:c.140G>A,ENSP00000380150.4:p.Arg47His,CARD11 GOF,616452,"Splenomegaly, lymphadenopathy, poor vaccine response","AF_EXAC=1e-05;ALLELEID=523067;CLNDISDB=MONDO:MONDO:0014081,MedGen:C3554686,OMIM:615206,Orphanet:357237|MONDO:MONDO:0014645,MedGen:C4551967,OMIM:616452,Orphanet:464336|MedGen:C3661900;CLNDN=Severe_combined_immunodeficiency_due_to_CARD11_deficiency|BENTA_disease|not_provided;CLNHGVS=NC_000007.14:g.2947655C>T;CLNREVSTAT=criteria_provided,_multiple_submitters,_no_conflicts;CLNSIG=Pathogenic/Likely_pathogenic;CLNSIGSCV=SCV000772995|SCV005326075;CLNVC=single_nucleotide_variant;CLNVCSO=SO:0001483;CLNVI=ClinGen:CA4132883;GENEINFO=CARD11:84433;MC=SO:0001583|missense_variant;ORIGIN=1;RS=765680532","criteria_provided,_multiple_submitters,_no_conflicts",0.39,SNV,GT:AD:AF:DP:F1R2:F2R1:SB,"0/1:29,17:0.39:46:13,8:9,7:12,17,6,11",1943.0,65.0,Female,British,,,"E78.0 Pure hypercholesterolaemia|H26.9 Cataract, unspecified|I10 Essential (primary) hypertension|I67.9 Cerebrovascular disease, unspecified|J18.1 Lobar pneumonia, unspecified|J45.9 Asthma, unspecified|J84.1 Other interstitial pulmonary diseases with fibrosis|J98.4 Other disorders of lung|K21.9 Gastro-oesophageal reflux disease without oesophagitis|K40.9 Unilateral or unspecified inguinal hernia, without obstruction or gangrene|K57.3 Diverticular disease of large intestine without perforation or abscess|K57.9 Diverticular disease of intestine, part unspecified, without perforation or abscess|M19.9 Arthrosis, unspecified|N18.9 Chronic renal failure, unspecified|Z90.7 Acquired absence of genital organ(s)|Z96.1 Presence of intraocular lens","H26.9 Cataract, unspecified|J18.1 Lobar pneumonia, unspecified|K57.3 Diverticular disease of large intestine without perforation or abscess","E78.0 Pure hypercholesterolaemia|I10 Essential (primary) hypertension|I67.9 Cerebrovascular disease, unspecified|J45.9 Asthma, unspecified|J84.1 Other interstitial pulmonary diseases with fibrosis|J98.4 Other disorders of lung|K21.9 Gastro-oesophageal reflux disease without oesophagitis|K40.9 Unilateral or unspecified inguinal hernia, without obstruction or gangrene|K57.9 Diverticular disease of intestine, part unspecified, without perforation or abscess|M19.9 Arthrosis, unspecified|N18.9 Chronic renal failure, unspecified|Z90.7 Acquired absence of genital organ(s)|Z96.1 Presence of intraocular lens",hypertension|emphysema/chronic bronchitis|asthma|diverticular disease/diverticulitis|osteoarthritis|depression|hayfever/allergic rhinitis|eczema/dermatitis,,,1.06,,17.18,25.0,16.9,72.9,326.3,1.5,27.87,29.52,34.62,85.29,7.63,116.13,80.73,0.3,5.62,3.34,61.8,0.0,0.0,363.0,0.276,16.09,4.775,13.03,0.044,0.912,5.4,,"['3.02', '2.92', '2.76']","['2.17', '2.12', '2.05']"
1023380,chr3,30691504,C,T,missense_variant,MODERATE,TGFBR2,,6.841e-07,Pathogenic/Likely_pathogenic,ENST00000295754.10:c.1609C>T,ENSP00000295754.5:p.Arg537Cys,Loeys Dietz syndrome due to TGFBR2 deficiency,610168,"Recurrent respiratory infectons, eczema, food allergies, hyperextensible joints, scoliosis, retention of primary teeths, aortic anuerysms.","ALLELEID=27546;CLNDISDB=MONDO:MONDO:0012427,MedGen:C2674574,OMIM:610168,Orphanet:558|MedGen:C3661900|MONDO:MONDO:0019625,MedGen:C4707243,OMIM:PS607086,Orphanet:91387;CLNDN=Loeys-Dietz_syndrome_2|not_provided|Familial_thoracic_aortic_aneurysm_and_aortic_dissection;CLNHGVS=NC_000003.12:g.30691504C>T;CLNREVSTAT=criteria_provided,_multiple_submitters,_no_conflicts;CLNSIG=Pathogenic/Likely_pathogenic;CLNSIGSCV=SCV000250956|SCV000658826|SCV000987424|SCV002025505|SCV002703107|SCV003799079;CLNVC=single_nucleotide_variant;CLNVCSO=SO:0001483;CLNVI=ClinGen:CA020742|OMIM:190182.0007|UniProtKB:P37173#VAR_022362;GENEINFO=TGFBR2:7048;MC=SO:0001583|missense_variant;ORIGIN=1;RS=104893809","criteria_provided,_multiple_submitters,_no_conflicts",0.087,SNV,GT:AD:AF:DP:F1R2:F2R1:SB,"0/1:46,3:0.087:49:19,1:19,2:14,32,2,1",1949.0,59.0,Male,Any other white background,,,"D64.9 Anaemia, unspecified|I10 Essential (primary) hypertension|M20.0 Deformity of finger(s)|R29.6 Tendency to fall, not elsewhere classified|S01.8 Open wound of other parts of head|S60.9 Superficial injury of wrist and hand, unspecified|S80.9 Superficial injury of lower leg, unspecified|T92.6 Sequelae of crushing injury and traumatic amputation of upper limb|W19.0 Home","M20.0 Deformity of finger(s)|R29.6 Tendency to fall, not elsewhere classified","D64.9 Anaemia, unspecified|I10 Essential (primary) hypertension|S01.8 Open wound of other parts of head|S60.9 Superficial injury of wrist and hand, unspecified|S80.9 Superficial injury of lower leg, unspecified|T92.6 Sequelae of crushing injury and traumatic amputation of upper limb|W19.0 Home",,,,1.04,,21.36,23.2,39.2,72.2,304.7,1.86,33.71,31.2,33.98,91.84,8.83,110.98,90.43,0.4,7.28,2.99,54.2,0.0,0.0,207.0,0.182,16.31,4.947,14.01,0.039,0.798,5.52,,"['3.26', '3.28']","['2.38', '2.32']"
1028026,chr20,63687765,G,T,missense_variant,MODERATE,RTEL1,6.568e-06,2.112e-05,Pathogenic/Likely_pathogenic,ENST00000360203.11:c.1476G>T,ENSP00000353332.5:p.Met492Ile,DKCA4,616373,"Bone marrow failure, pulmonary and hepatic fibrosis, nail dystrophy, leukoplakia, reticulate skin pigmentation; microcephaly, neurodevelopmental delay","AF_ESP=8e-05;AF_EXAC=6e-05;ALLELEID=51187;CLNDISDB=MONDO:MONDO:0014076,MedGen:C3554656,OMIM:615190|MONDO:MONDO:0014613,MedGen:C4225346,OMIM:616373,Orphanet:2032|MedGen:C3661900|MONDO:MONDO:0015780,MedGen:C0265965,OMIM:PS127550,Orphanet:1775;CLNDN=Dyskeratosis_congenita,_autosomal_recessive_5|Pulmonary_fibrosis_and/or_bone_marrow_failure,_Telomere-related,_3|not_provided|Dyskeratosis_congenita;CLNHGVS=NC_000020.11:g.63687765G>T;CLNREVSTAT=criteria_provided,_multiple_submitters,_no_conflicts;CLNSIG=Pathogenic/Likely_pathogenic;CLNSIGSCV=SCV000699742|SCV000964946|SCV003812007|SCV004169101|SCV004209343;CLNVC=single_nucleotide_variant;CLNVCSO=SO:0001483;CLNVI=ClinGen:CA130949|OMIM:608833.0003;GENEINFO=RTEL1:51750|RTEL1-TNFRSF6B:100533107;MC=SO:0001583|missense_variant,SO:0001619|non-coding_transcript_variant;ORIGIN=1;RS=370343781","criteria_provided,_multiple_submitters,_no_conflicts",0.583,SNV,GT:AD:AF:DP:F1R2:F2R1:SB,"0/1:30,38:0.583:68:10,12:8,18:15,15,18,20",1949.0,60.0,Male,British,2019-03-24,69.4,"E11.9 Without complications|G81.9 Hemiplegia, unspecified|H53.4 Visual field defects|I10 Essential (primary) hypertension|I20.9 Angina pectoris, unspecified|I48 Atrial fibrillation and flutter|I48.0 Paroxysmal atrial fibrillation|I48.9 Atrial fibrillation and atrial flutter,  unspecified|I61.8 Other intracerebral haemorrhage|J18.9 Pneumonia, unspecified|K25.9 Unspecified as acute or chronic, without haemorrhage or perforation|K29 Gastritis and duodenitis|R07.4 Chest pain, unspecified|Z92.2 Personal history of long-term (current) use of other medicaments","I20.9 Angina pectoris, unspecified|I48 Atrial fibrillation and flutter|I61.8 Other intracerebral haemorrhage|K25.9 Unspecified as acute or chronic, without haemorrhage or perforation|K29 Gastritis and duodenitis|R07.4 Chest pain, unspecified","E11.9 Without complications|G81.9 Hemiplegia, unspecified|H53.4 Visual field defects|I10 Essential (primary) hypertension|I48 Atrial fibrillation and flutter|I48.0 Paroxysmal atrial fibrillation|I48.9 Atrial fibrillation and atrial flutter,  unspecified|J18.9 Pneumonia, unspecified|Z92.2 Personal history of long-term (current) use of other medicaments",gastritis/gastric erosions,,,0.39,,19.74,34.8,25.8,74.3,326.0,1.85,38.99,28.03,32.93,85.11,9.19,109.0,83.1,0.54,11.38,2.14,45.2,0.0,0.0,179.0,0.164,16.33,5.317,14.08,0.045,0.85,4.74,"I61.9 Intracerebral haemorrhage, unspecified","['3.74', '3.51', '3.52']","['2.4', '2.43', '2.34']"
1035382,chr9,99149253,G,A,missense_variant,MODERATE,TGFBR1,6.578e-06,,Pathogenic,ENST00000374994.9:c.1460G>A,ENSP00000364133.4:p.Arg487Gln,Loeys Dietz syndrome due to TGFBR1 deficiency,609192,"Recurrent respiratory infectons, eczema, food allergies, hyperextensible joints, scoliosis, retention of primary teeths, aortic anuerysms.","ALLELEID=27564;CLNDISDB=MedGen:C3661900|MONDO:MONDO:0018954,MedGen:C2697932,OMIM:PS609192,Orphanet:60030|MONDO:MONDO:0019625,MedGen:C4707243,OMIM:PS607086,Orphanet:91387|.|MONDO:MONDO:0012212,MedGen:C4551955,OMIM:609192,Orphanet:60030,Orphanet:97295;CLNDN=not_provided|Loeys-Dietz_syndrome|Familial_thoracic_aortic_aneurysm_and_aortic_dissection|TGFBR1-related_disorder|Loeys-Dietz_syndrome_1;CLNHGVS=NC_000009.12:g.99149253G>A;CLNREVSTAT=criteria_provided,_multiple_submitters,_no_conflicts;CLNSIG=Pathogenic;CLNSIGSCV=SCV000200567|SCV000250899|SCV000548337|SCV000782362|SCV001363333|SCV002512453|SCV002696980|SCV002767253|SCV004704311|SCV005091040;CLNVC=single_nucleotide_variant;CLNVCSO=SO:0001483;CLNVI=ClinGen:CA008776|OMIM:190181.0006|UniProtKB:P36897#VAR_029484;GENEINFO=TGFBR1:7046;MC=SO:0001583|missense_variant;ORIGIN=1;RS=113605875","criteria_provided,_multiple_submitters,_no_conflicts",0.087,SNV,GT:AD:AF:DP:F1R2:F2R1:SB,"0/1:44,3:0.087:47:14,0:25,3:23,21,0,3",1965.0,42.0,Male,British,,,,,,,,,1.94,,22.36,28.5,31.2,80.7,381.9,,,,,,,,,,,,,,,,,,,,,,,,"['5.88', '5.91', '4.5']","['4.45', '5.04', '4.49']"
1043586,chrX,48688097,G,A,splice_donor_variant,HIGH,WAS,,9.161e-07,Pathogenic,ENST00000376701.5:c.777+1G>A,,Wiskott-Aldrich syndrome (WAS LOF)| X-linked neutropenia/ myelodysplasia WAS GOF,301000| 313900| 300299,"Thrombocytopenia with small platelets, recurrent bacterial and viral infections, bloody diarrhea,  eczema, lymphoma, autoimmune disease, IgA nephropathy, vasculitis. XL thrombocytopenia is a mild form of WAS| Neutropenia, myeloid maturation arrest, monocytopenia, variable lymphoid anomalies","ALLELEID=360647;CLNDISDB=MedGen:C3661900|MONDO:MONDO:0010518,MedGen:C0043194,OMIM:301000,Orphanet:906|MeSH:D030342,MedGen:C0950123|MONDO:MONDO:0010743,MedGen:C1839163,OMIM:313900,Orphanet:268322,Orphanet:852|MONDO:MONDO:0010294,MedGen:C1845987,OMIM:300299,Orphanet:86788;CLNDN=not_provided|Wiskott-Aldrich_syndrome|Inborn_genetic_diseases|Thrombocytopenia_1|X-linked_severe_congenital_neutropenia;CLNHGVS=NC_000023.11:g.48688097G>A;CLNREVSTAT=criteria_provided,_multiple_submitters,_no_conflicts;CLNSIG=Pathogenic;CLNSIGSCV=SCV000490880|SCV000551383|SCV001478630|SCV003807503|SCV004047625|SCV004981014;CLNVC=single_nucleotide_variant;CLNVCSO=SO:0001483;CLNVI=ClinGen:CA16043277|Genetic_Testing_Registry_(GTR):GTR000613589;GENEINFO=WAS:7454;MC=SO:0001575|splice_donor_variant;ORIGIN=1;RS=1057517845","criteria_provided,_multiple_submitters,_no_conflicts",0.094,SNV,GT:AD:AF:DP:F1R2:F2R1:SB,"0/1:34,3:0.094:37:15,0:13,2:13,21,2,1",1957.0,52.0,Male,British,,,"D03.1 Melanoma in situ of eyelid, including canthus|D22.1 Melanocytic naevi of eyelid, including canthus|E03.9 Hypothyroidism, unspecified|I10 Essential (primary) hypertension|K29.8 Duodenitis|K52.9 Non-infective gastro-enteritis and colitis, unspecified|K59.0 Constipation|M17.9 Gonarthrosis, unspecified|M23.2 Derangement of meniscus due to old tear or injury|R07.4 Chest pain, unspecified|R13 Dysphagia|R69 Unknown and unspecified causes of morbidity|U07.4 Emergency use of U07.4|Z11.5 Special screening examination for other viral diseases|Z92.2 Personal history of long-term (current) use of other medicaments","D03.1 Melanoma in situ of eyelid, including canthus|K29.8 Duodenitis|K52.9 Non-infective gastro-enteritis and colitis, unspecified|M23.2 Derangement of meniscus due to old tear or injury|R07.4 Chest pain, unspecified|R13 Dysphagia","D22.1 Melanocytic naevi of eyelid, including canthus|E03.9 Hypothyroidism, unspecified|I10 Essential (primary) hypertension|K59.0 Constipation|M17.9 Gonarthrosis, unspecified|R69 Unknown and unspecified causes of morbidity|U07.4 Emergency use of U07.4|Z11.5 Special screening examination for other viral diseases|Z92.2 Personal history of long-term (current) use of other medicaments",irritable bowel syndrome,,,0.61,20.4,27.82,61.7,61.0,65.2,386.1,1.74,28.22,30.83,34.99,88.11,8.26,101.95,77.42,0.55,8.91,3.68,59.6,0.0,0.0,262.7,0.217,16.64,4.653,12.6,0.041,0.887,6.18,,"['5.39', '5.26', '4.99', '5.19', '5.16', '4.82']","['4.28', '4.24', '4.07', '4.09', '3.95', '3.76']"
1053758,chr4,2831581,C,A,missense_variant,MODERATE,SH3BP2,,6.968e-07,Pathogenic/Likely_pathogenic,ENST00000503393.8:c.1252C>A,ENSP00000422168.3:p.Pro418Thr,Cherubism,118400,Bone degeneration in jaws,"ALLELEID=829071;CLNDISDB=MedGen:C3661900|MONDO:MONDO:0007315,MedGen:C0008029,OMIM:118400,Orphanet:184|.;CLNDN=not_provided|Fibrous_dysplasia_of_jaw|SH3BP2-related_disorder;CLNHGVS=NC_000004.12:g.2831581C>A;CLNREVSTAT=criteria_provided,_multiple_submitters,_no_conflicts;CLNSIG=Pathogenic/Likely_pathogenic;CLNSIGSCV=SCV001235953|SCV002786363|SCV005330391;CLNVC=single_nucleotide_variant;CLNVCSO=SO:0001483;CLNVI=ClinGen:CA2819446;GENEINFO=SH3BP2:6452;MC=SO:0001583|missense_variant;ORIGIN=1;RS=757336022","criteria_provided,_multiple_submitters,_no_conflicts",0.138,SNV,GT:AD:AF:DP:F1R2:F2R1:SB,"0/1:25,4:0.138:29:14,1:7,2:14,11,3,1",1942.0,67.0,Female,British,2020-10-27,78.3,"B96.2 Escherichia coli [E. coli] as the cause of diseases classified to other chapters|D50.9 Iron deficiency anaemia, unspecified|E78.0 Pure hypercholesterolaemia|E86 Volume depletion|G20 Parkinson's disease|G72.4 Inflammatory myopathy, not elsewhere classified|I10 Essential (primary) hypertension|I48.9 Atrial fibrillation and atrial flutter,  unspecified|I65.2 Occlusion and stenosis of carotid artery|J69.0 Pneumonitis due to food and vomit|M33.2 Polymyositis|M62.5 Muscle wasting and atrophy, not elsewhere classified|N39.0 Urinary tract infection, site not specified|R07.4 Chest pain, unspecified|R13 Dysphagia|R25.2 Cramp and spasm|R29.6 Tendency to fall, not elsewhere classified|R33 Retention of urine|R42 Dizziness and giddiness|R69 Unknown and unspecified causes of morbidity|S82.40 Fracture of fibula alone (closed)|W19.0 Home|Z03.8 Observation for other suspected diseases and conditions|Z50.1 Other physical therapy|Z50.7 Occupational therapy and vocational rehabilitation, not elsewhere classified|Z82.4 Family history of ischaemic heart disease and other diseases of the circulatory system|Z86.7 Personal history of diseases of the circulatory system|Z92.2 Personal history of long-term (current) use of other medicaments","D50.9 Iron deficiency anaemia, unspecified|G72.4 Inflammatory myopathy, not elsewhere classified|J69.0 Pneumonitis due to food and vomit|M33.2 Polymyositis|N39.0 Urinary tract infection, site not specified|R07.4 Chest pain, unspecified|R69 Unknown and unspecified causes of morbidity|S82.40 Fracture of fibula alone (closed)","B96.2 Escherichia coli [E. coli] as the cause of diseases classified to other chapters|E78.0 Pure hypercholesterolaemia|E86 Volume depletion|G20 Parkinson's disease|G72.4 Inflammatory myopathy, not elsewhere classified|I10 Essential (primary) hypertension|I48.9 Atrial fibrillation and atrial flutter,  unspecified|I65.2 Occlusion and stenosis of carotid artery|M62.5 Muscle wasting and atrophy, not elsewhere classified|N39.0 Urinary tract infection, site not specified|R13 Dysphagia|R25.2 Cramp and spasm|R29.6 Tendency to fall, not elsewhere classified|R33 Retention of urine|R42 Dizziness and giddiness|Z03.8 Observation for other suspected diseases and conditions|Z50.1 Other physical therapy|Z50.7 Occupational therapy and vocational rehabilitation, not elsewhere classified|Z82.4 Family history of ischaemic heart disease and other diseases of the circulatory system|Z86.7 Personal history of diseases of the circulatory system|Z92.2 Personal history of long-term (current) use of other medicaments",hypertension,,,1.17,,39.11,40.7,20.2,87.9,361.4,1.87,31.9,30.66,34.13,89.85,8.24,114.51,82.18,0.33,5.66,3.58,61.0,0.0,0.0,305.5,0.251,16.41,4.162,15.38,0.053,1.274,5.87,"I63.9 Cerebral infarction, unspecified",,
1078566,chr12,49039611,G,A,stop_gained,HIGH,KMT2D,,6.871e-07,Pathogenic/Likely_pathogenic,ENST00000301067.12:c.8053C>T,ENSP00000301067.7:p.Arg2685Ter,Kabuki Syndrome 1 due to KMT2D deficiency,147920,"Typical facial abnormalities, cleft or high arched palate, skeletal abnormalities, short stature, intellectual disability, congenital heart defects, recurrent infections (otitis media, pneumonia) in 50% of patients. Autoimmunity may be present","ALLELEID=168936;CLNDISDB=MedGen:C3661900|MONDO:MONDO:0007843,MedGen:CN030661,OMIM:147920,Orphanet:2322;CLNDN=not_provided|Kabuki_syndrome_1;CLNHGVS=NC_000012.12:g.49039611G>A;CLNREVSTAT=criteria_provided,_multiple_submitters,_no_conflicts;CLNSIG=Pathogenic/Likely_pathogenic;CLNSIGSCV=SCV000193479|SCV000781610|SCV005079255;CLNVC=single_nucleotide_variant;CLNVCSO=SO:0001483;CLNVI=ClinGen:CA271659;GENEINFO=KMT2D:8085;MC=SO:0001587|nonsense;ORIGIN=1;RS=587783727","criteria_provided,_multiple_submitters,_no_conflicts",0.05,SNV,GT:AD:AF:DP:F1R2:F2R1:SB,"0/1:84,3:0.05:87:37,2:31,1:28,56,1,2",1937.0,70.0,Male,British,2017-02-22,79.4,"C61 Malignant neoplasm of prostate|C78.0 Secondary malignant neoplasm of lung|C78.7 Secondary malignant neoplasm of liver|D23.3 Skin of other and unspecified parts of face|I48 Atrial fibrillation and flutter|J98.0 Diseases of bronchus, not elsewhere classified|K59.0 Constipation|M16.1 Other primary coxarthrosis|N13.3 Other and unspecified hydronephrosis|N13.4 Hydroureter|N17.9 Acute renal failure, unspecified|N39.0 Urinary tract infection, site not specified|N99.5 Malfunction of external stoma of urinary tract|R31 Unspecified haematuria|R33 Retention of urine|S92.00 Fracture of calcaneus (closed)|T83.1 Mechanical complication of other urinary devices and implants|W11.9 Unspecified place|Y83.3 Surgical operation with formation of external stoma","C61 Malignant neoplasm of prostate|D23.3 Skin of other and unspecified parts of face|M16.1 Other primary coxarthrosis|N13.3 Other and unspecified hydronephrosis|N39.0 Urinary tract infection, site not specified|R33 Retention of urine|S92.00 Fracture of calcaneus (closed)|T83.1 Mechanical complication of other urinary devices and implants","C61 Malignant neoplasm of prostate|C78.0 Secondary malignant neoplasm of lung|C78.7 Secondary malignant neoplasm of liver|I48 Atrial fibrillation and flutter|J98.0 Diseases of bronchus, not elsewhere classified|K59.0 Constipation|N13.4 Hydroureter|N17.9 Acute renal failure, unspecified|N99.5 Malfunction of external stoma of urinary tract|R31 Unspecified haematuria|W11.9 Unspecified place|Y83.3 Surgical operation with formation of external stoma",hayfever/allergic rhinitis|heart/cardiac problem,,,2.03,34.9,24.54,29.0,31.3,85.2,303.4,1.5,26.9,31.3,33.5,93.7,7.7,107.9,85.4,0.5,8.5,3.4,63.5,0.0,0.0,292.0,0.225,16.0,5.06,13.6,0.059,1.16,5.4,"C80.0 Malignant neoplasm, primary site unknown, so stated","['4.6', '4.48']","['3.37', '3.25']"
1097677,chr20,63687936,G,A,splice_acceptor_variant,HIGH,RTEL1,,6.848e-06,Pathogenic/Likely_pathogenic,ENST00000360203.11:c.1482_1G>A,,DKCA4,616373,"Bone marrow failure, pulmonary and hepatic fibrosis, nail dystrophy, leukoplakia, reticulate skin pigmentation; microcephaly, neurodevelopmental delay","ALLELEID=214164;CLNDISDB=MONDO:MONDO:0014076,MedGen:C3554656,OMIM:615190|MONDO:MONDO:0014613,MedGen:C4225346,OMIM:616373,Orphanet:2032|MONDO:MONDO:0015780,MedGen:C0265965,OMIM:PS127550,Orphanet:1775|MONDO:MONDO:0800029,MedGen:C5561926,OMIM:178500,Orphanet:2032,Orphanet:79126;CLNDN=Dyskeratosis_congenita,_autosomal_recessive_5|Pulmonary_fibrosis_and/or_bone_marrow_failure,_Telomere-related,_3|Dyskeratosis_congenita|Interstitial_lung_disease_2;CLNHGVS=NC_000020.11:g.63687936G>A;CLNREVSTAT=criteria_provided,_multiple_submitters,_no_conflicts;CLNSIG=Pathogenic/Likely_pathogenic;CLNSIGSCV=SCV000256238|SCV000699743|SCV004571388;CLNVC=single_nucleotide_variant;CLNVCSO=SO:0001483;CLNVI=ClinGen:CA279370;GENEINFO=RTEL1:51750|RTEL1-TNFRSF6B:100533107;MC=SO:0001574|splice_acceptor_variant;ORIGIN=5;RS=863225129","criteria_provided,_multiple_submitters,_no_conflicts",0.434,SNV,GT:AD:AF:DP:F1R2:F2R1:SB,"0/1:30,19:0.434:49:10,10:13,8:18,12,13,6",1941.0,66.0,Female,British,,,"F05.9 Delirium, unspecified|M54.99 Dorsalgia, unspecified (Site unspecified)|N39.0 Urinary tract infection, site not specified|R26.8 Other and unspecified abnormalities of gait and mobility|R29.6 Tendency to fall, not elsewhere classified|R35 Polyuria","N39.0 Urinary tract infection, site not specified|R29.6 Tendency to fall, not elsewhere classified","F05.9 Delirium, unspecified|M54.99 Dorsalgia, unspecified (Site unspecified)|R26.8 Other and unspecified abnormalities of gait and mobility|R35 Polyuria",angina|hypertension,,,7.78,,37.77,43.0,46.1,83.4,317.2,1.4,20.0,31.9,33.3,95.7,7.9,111.5,84.2,0.4,5.8,5.1,72.7,0.0,0.0,265.0,0.208,16.2,3.8,13.4,0.066,1.73,7.0,,"['2.01', '1.99']","['1.43', '1.44']"
1120652,chr5,1266480,C,T,missense_variant,MODERATE,TERT,,6.862e-07,Pathogenic/Likely_pathogenic,ENST00000310581.10:c.2638G>A,ENSP00000309572.5:p.Ala880Thr,DKCA2,614742| 613989,"Bone marrow failure, pulmonary and hepatic fibrosis, nail dystrophy, leukoplakia, reticulate skin pigmentation; microcephaly, neurodevelopmental delay","ALLELEID=923737;CLNDISDB=MeSH:D054990,MedGen:C1800706|MONDO:MONDO:0013521,MedGen:C3151443,OMIM:613989|MONDO:MONDO:0013878,MedGen:C3553617,OMIM:614742,Orphanet:88|MedGen:C3661900;CLNDN=Idiopathic_Pulmonary_Fibrosis|Dyskeratosis_congenita,_autosomal_dominant_2|Pulmonary_fibrosis_and/or_bone_marrow_failure,_Telomere-related,_1|not_provided;CLNHGVS=NC_000005.10:g.1266480C>T;CLNREVSTAT=criteria_provided,_multiple_submitters,_no_conflicts;CLNSIG=Pathogenic/Likely_pathogenic;CLNSIGSCV=SCV001394182|SCV002067330|SCV003839095|SCV003839096|SCV004226772;CLNVC=single_nucleotide_variant;CLNVCSO=SO:0001483;CLNVI=ClinGen:CA359073151;GENEINFO=TERT:7015;MC=SO:0001583|missense_variant,SO:0001619|non-coding_transcript_variant;ORIGIN=1;RS=1748613571","criteria_provided,_multiple_submitters,_no_conflicts",0.068,SNV,GT:AD:AF:DP:F1R2:F2R1:SB,"0/1:43,3:0.068:46:21,1:19,1:30,13,2,1",1947.0,60.0,Female,British,,,C50.8 Overlapping lesion of breast|K04.5 Chronic apical periodontitis,C50.8 Overlapping lesion of breast|K04.5 Chronic apical periodontitis,,hypothyroidism/myxoedema|high cholesterol,,,0.71,,22.96,25.8,26.5,78.4,340.0,2.7,40.0,32.0,34.7,92.4,10.6,104.8,83.3,0.5,7.6,3.3,49.9,0.0,0.0,246.0,0.261,17.0,4.27,12.9,0.052,1.21,6.7,,"['2.46', '2.08', '1.16']","['1.91', '1.91', '1.15']"
