2117086,chr17,16948752,G,C,stop_gained,HIGH,TNFRSF13B,4.599e-05,4.173e-05,Pathogenic,ENST00000261652.7:c.431C>G,ENSP00000261652.2:p.Ser144Ter,TACI deficiency,240500,Variable clinical expression,"ALLELEID=260152;CLNDISDB=MONDO:MONDO:0009413,MedGen:C3150354,OMIM:240500,Orphanet:1572|MedGen:CN169374|MedGen:C3661900|MONDO:MONDO:0011864,MedGen:C3149378,OMIM:607594,Orphanet:1572;CLNDN=Immunodeficiency,_common_variable,_2|not_specified|not_provided|Immunodeficiency,_common_variable,_1;CLNHGVS=NC_000017.11:g.16948752G>C;CLNREVSTAT=criteria_provided,_multiple_submitters,_no_conflicts;CLNSIG=Pathogenic;CLNSIGSCV=SCV000322127|SCV000831182|SCV001160601|SCV001250125|SCV005049847;CLNVC=single_nucleotide_variant;CLNVCSO=SO:0001483;CLNVI=ClinGen:CA8414017;GENEINFO=TNFRSF13B:23495;MC=SO:0001587|nonsense;ORIGIN=1;RS=104894650","criteria_provided,_multiple_submitters,_no_conflicts",0.403,SNV,GT:AD:AF:DP:F1R2:F2R1:SB,"0/1:41,25:0.403:66:19,11:11,9:23,18,14,11",1952.0,57.0,Male,British,,,"K40.9 Unilateral or unspecified inguinal hernia, without obstruction or gangrene","K40.9 Unilateral or unspecified inguinal hernia, without obstruction or gangrene",,iron deficiency anaemia,,,1.92,33.0,21.26,25.0,49.5,152.1,340.8,1.73,20.31,29.28,34.44,85.0,7.9,109.38,78.13,0.43,5.05,6.24,73.1,0.0,0.0,237.2,0.187,16.3,4.865,15.27,0.059,1.218,8.54,,"['6.15', '6.15', '6.08']","['4.94', '4.89', '4.71']"
2126227,chr10,88990896,T,C,missense_variant,MODERATE,FAS,,1.368e-06,Likely_pathogenic,ENST00000652046.1:c.20T>C,ENSP00000498466.1:p.Leu7Pro,ALPS-FAS,601859,"Splenomegaly, adenopathies, autoimmune cytopenias, increased lymphoma risk, IgG and A normal or increased, elevated serum FasL and IL-10, vitamin B12","ALLELEID=1203249;CLNDISDB=MedGen:C3661900|MONDO:MONDO:0011158,MedGen:C1328840,OMIM:601859,Orphanet:3261;CLNDN=not_provided|Autoimmune_lymphoproliferative_syndrome_type_1;CLNHGVS=NC_000010.11:g.88990896T>C;CLNREVSTAT=criteria_provided,_multiple_submitters,_no_conflicts;CLNSIG=Likely_pathogenic;CLNSIGSCV=SCV001815332|SCV003439630;CLNVC=single_nucleotide_variant;CLNVCSO=SO:0001483;CLNVI=ClinGen:CA377505811;GENEINFO=ACTA2:59|FAS:355;MC=SO:0001583|missense_variant,SO:0001619|non-coding_transcript_variant,SO:0001627|intron_variant;ORIGIN=1;RS=2133384423","criteria_provided,_multiple_submitters,_no_conflicts",0.369,SNV,GT:AD:AF:DP:F1R2:F2R1:SB,"0/1:50,30:0.369:80:13,7:17,10:27,23,17,13",1940.0,68.0,Female,British,,,"E03.9 Hypothyroidism, unspecified|E66.9 Obesity, unspecified|I34.0 Mitral (valve) insufficiency|I83.9 Varicose veins of lower extremities without ulcer or inflammation|K80.2 Calculus of gallbladder without cholecystitis|K82.4 Cholesterolosis of gallbladder|M19.9 Arthrosis, unspecified|M19.91 Arthrosis, unspecified (Shoulder region)|M25.51 Pain in joint (Shoulder region)|M47.96 Spondylosis, unspecified (Lumbar region)|M75.1 Rotator cuff syndrome|M75.4 Impingement syndrome of shoulder|R07.4 Chest pain, unspecified|R10.4 Other and unspecified abdominal pain|Z86.7 Personal history of diseases of the circulatory system","I83.9 Varicose veins of lower extremities without ulcer or inflammation|K80.2 Calculus of gallbladder without cholecystitis|M25.51 Pain in joint (Shoulder region)|M75.1 Rotator cuff syndrome|R07.4 Chest pain, unspecified|R10.4 Other and unspecified abdominal pain","E03.9 Hypothyroidism, unspecified|E66.9 Obesity, unspecified|I34.0 Mitral (valve) insufficiency|I83.9 Varicose veins of lower extremities without ulcer or inflammation|K82.4 Cholesterolosis of gallbladder|M19.9 Arthrosis, unspecified|M19.91 Arthrosis, unspecified (Shoulder region)|M47.96 Spondylosis, unspecified (Lumbar region)|M75.4 Impingement syndrome of shoulder|Z86.7 Personal history of diseases of the circulatory system",,,,0.87,,11.58,17.2,23.1,84.8,194.6,1.51,37.12,32.64,34.21,95.43,8.23,109.89,86.41,0.22,5.39,2.24,55.1,0.0,0.0,272.1,0.223,16.01,4.316,12.82,0.031,0.726,4.07,,"['2.7', '2.73', '2.66']","['2.13', '2.19', '2.13']"
2137440,chr17,16952447,G,T,stop_gained&splice_region_variant,HIGH,TNFRSF13B,4.594e-05,1.437e-05,Pathogenic,ENST00000261652.7:c.198C>A,ENSP00000261652.2:p.Cys66Ter,TACI deficiency,609529| 240500,Variable clinical expression,"AF_EXAC=1e-05;AF_TGP=0.0002;ALLELEID=844739;CLNDISDB=MONDO:MONDO:0009413,MedGen:C3150354,OMIM:240500,Orphanet:1572|MONDO:MONDO:0012291,MedGen:C1836032,OMIM:609529;CLNDN=Immunodeficiency,_common_variable,_2|Immunoglobulin_A_deficiency_2;CLNHGVS=NC_000017.11:g.16952447G>T;CLNREVSTAT=criteria_provided,_multiple_submitters,_no_conflicts;CLNSIG=Pathogenic;CLNSIGSCV=SCV001206752|SCV001429954|SCV002573177|SCV005398060;CLNVC=single_nucleotide_variant;CLNVCSO=SO:0001483;CLNVI=ClinGen:CA8414090;GENEINFO=TNFRSF13B:23495;MC=SO:0001587|nonsense;ORIGIN=5;RS=144718007","criteria_provided,_multiple_submitters,_no_conflicts",0.049,SNV,GT:AD:AF:DP:F1R2:F2R1:SB,"0/1:79,3:0.049:82:31,1:25,1:43,36,2,1",1951.0,58.0,Female,British,,,"C44.6 Skin of upper limb, including shoulder|E66.9 Obesity, unspecified|I10 Essential (primary) hypertension|I67.9 Cerebrovascular disease, unspecified|I87.2 Venous insufficiency (chronic) (peripheral)|J22 Unspecified acute lower respiratory infection|J45.9 Asthma, unspecified|K40.9 Unilateral or unspecified inguinal hernia, without obstruction or gangrene|M13.9 Arthritis, unspecified|M25.56 Pain in joint (Lower leg)|M87.20 Osteonecrosis due to previous trauma (Multiple sites)|R10.4 Other and unspecified abdominal pain|Y83.8 Other surgical procedures|Z85.9 Personal history of malignant neoplasm, unspecified|Z91.0 Personal history of allergy, other than to drugs and biological substances|Z92.2 Personal history of long-term (current) use of other medicaments","C44.6 Skin of upper limb, including shoulder|I87.2 Venous insufficiency (chronic) (peripheral)|J22 Unspecified acute lower respiratory infection|K40.9 Unilateral or unspecified inguinal hernia, without obstruction or gangrene|M25.56 Pain in joint (Lower leg)|R10.4 Other and unspecified abdominal pain","E66.9 Obesity, unspecified|I10 Essential (primary) hypertension|I67.9 Cerebrovascular disease, unspecified|J45.9 Asthma, unspecified|M13.9 Arthritis, unspecified|M87.20 Osteonecrosis due to previous trauma (Multiple sites)|Z85.9 Personal history of malignant neoplasm, unspecified|Z91.0 Personal history of allergy, other than to drugs and biological substances|Z92.2 Personal history of long-term (current) use of other medicaments",hypertension|asthma|migraine,malignant melanoma,['2005'],1.69,,15.4,17.7,21.5,52.9,188.2,2.36,24.23,30.55,34.29,89.1,8.51,103.44,80.63,0.46,4.74,6.83,70.1,0.0,0.0,276.1,0.234,16.1,4.853,12.5,0.1,2.061,9.75,,"['2.94', '2.9']","['2.47', '2.41']"
2150214,chr2,203870886,C,T,missense_variant,MODERATE,CTLA4,,6.841e-07,Pathogenic/Likely_pathogenic,ENST00000648405.2:c.410C>T,ENSP00000497102.1:p.Pro137Leu,CTLA4 deficiency (ALPSV),616100,"Autoimmune cytopenias, enteropathy, interstitial lung disease, extra-lymphoid lymphocytic infiltration recurrent infections","ALLELEID=425459;CLNDISDB=MedGen:C3661900|MONDO:MONDO:0014493,MedGen:C4015214,OMIM:616100,Orphanet:436159|MONDO:MONDO:0012341,MedGen:C1857845,OMIM:609755|MONDO:MONDO:0011068,MedGen:C1832392,OMIM:601388|Human_Phenotype_Ontology:HP:0000872,MONDO:MONDO:0007699,MedGen:C0677607,OMIM:140300|Human_Phenotype_Ontology:HP:0002725,MONDO:MONDO:0007915,MedGen:C0024141,OMIM:152700,Orphanet:536;CLNDN=not_provided|Autoimmune_lymphoproliferative_syndrome_due_to_CTLA4_haploinsufficiency|Celiac_disease,_susceptibility_to,_3|Type_1_diabetes_mellitus_12|Hashimoto_thyroiditis|Systemic_lupus_erythematosus;CLNHGVS=NC_000002.12:g.203870886C>T;CLNREVSTAT=criteria_provided,_multiple_submitters,_no_conflicts;CLNSIG=Pathogenic/Likely_pathogenic;CLNSIGSCV=SCV000589754|SCV000774316|SCV000898639|SCV002058371|SCV002512464;CLNVC=single_nucleotide_variant;CLNVCSO=SO:0001483;CLNVI=ClinGen:CA350138741;GENEINFO=CTLA4:1493;MC=SO:0001583|missense_variant;ORIGIN=1;RS=1553657429","criteria_provided,_multiple_submitters,_no_conflicts",0.095,SNV,GT:AD:AF:DP:F1R2:F2R1:SB,"0/1:62,5:0.095:67:35,4:19,1:16,46,2,3",1940.0,68.0,Female,British,,,"E03.9 Hypothyroidism, unspecified|H25.1 Senile nuclear cataract|J22 Unspecified acute lower respiratory infection|J44.9 Chronic obstructive pulmonary disease, unspecified|J45.9 Asthma, unspecified|K29.6 Other gastritis|K29.8 Duodenitis|K44.9 Diaphragmatic hernia without obstruction or gangrene|K52.9 Non-infective gastro-enteritis and colitis, unspecified|K58.9 Irritable bowel syndrome without diarrhoea|K81.1 Chronic cholecystitis|M19.9 Arthrosis, unspecified|M47.92 Spondylosis, unspecified (Cervical region)|M48.06 Spinal stenosis (Lumbar region)|M51.2 Other specified intervertebral disk displacement|M62.82 Other specified disorders of muscle (Upper arm)|M75.1 Rotator cuff syndrome|M75.4 Impingement syndrome of shoulder|M80.98 Unspecified osteoporosis with pathological fracture (Other)|M81.9 Osteoporosis, unspecified|M81.99 Osteoporosis, unspecified (Site unspecified)|R05 Cough|R10.4 Other and unspecified abdominal pain|S01.8 Open wound of other parts of head|S42.30 Fracture of shaft of humerus (closed)|S72.00 Fracture of neck of femur (closed)|W01.0 Home|Z03.8 Observation for other suspected diseases and conditions|Z11.5 Special screening examination for other viral diseases|Z48.8 Other specified surgical follow-up care|Z50.1 Other physical therapy|Z50.7 Occupational therapy and vocational rehabilitation, not elsewhere classified|Z72.1 Alcohol use|Z88.0 Personal history of allergy to penicillin|Z91.0 Personal history of allergy, other than to drugs and biological substances","H25.1 Senile nuclear cataract|J22 Unspecified acute lower respiratory infection|K44.9 Diaphragmatic hernia without obstruction or gangrene|K52.9 Non-infective gastro-enteritis and colitis, unspecified|K81.1 Chronic cholecystitis|M51.2 Other specified intervertebral disk displacement|M75.4 Impingement syndrome of shoulder|S72.00 Fracture of neck of femur (closed)","E03.9 Hypothyroidism, unspecified|J44.9 Chronic obstructive pulmonary disease, unspecified|J45.9 Asthma, unspecified|K29.6 Other gastritis|K29.8 Duodenitis|K58.9 Irritable bowel syndrome without diarrhoea|M19.9 Arthrosis, unspecified|M47.92 Spondylosis, unspecified (Cervical region)|M48.06 Spinal stenosis (Lumbar region)|M62.82 Other specified disorders of muscle (Upper arm)|M75.1 Rotator cuff syndrome|M80.98 Unspecified osteoporosis with pathological fracture (Other)|M81.9 Osteoporosis, unspecified|M81.99 Osteoporosis, unspecified (Site unspecified)|R05 Cough|R10.4 Other and unspecified abdominal pain|S01.8 Open wound of other parts of head|S42.30 Fracture of shaft of humerus (closed)|Z03.8 Observation for other suspected diseases and conditions|Z11.5 Special screening examination for other viral diseases|Z48.8 Other specified surgical follow-up care|Z50.1 Other physical therapy|Z50.7 Occupational therapy and vocational rehabilitation, not elsewhere classified|Z72.1 Alcohol use|Z88.0 Personal history of allergy to penicillin|Z91.0 Personal history of allergy, other than to drugs and biological substances",emphysema/chronic bronchitis|hypothyroidism/myxoedema|hiatus hernia|osteoporosis|eye/eyelid problem|cholelithiasis/gall stones,,,1.4,,18.18,15.3,14.9,113.2,342.5,2.81,29.37,32.18,34.73,92.67,8.36,102.78,83.43,0.82,8.59,5.61,58.7,0.0,0.0,295.8,0.247,15.7,4.149,13.18,0.052,1.265,9.56,,"['2.21', '2.08', '1.79']","['1.56', '1.48', '1.19']"
2150955,chr3,30674228,C,T,missense_variant,MODERATE,TGFBR2,,6.841e-07,Pathogenic,ENST00000295754.10:c.1378C>T,ENSP00000295754.5:p.Arg460Cys,Loeys Dietz syndrome due to TGFBR2 deficiency,610168,"Recurrent respiratory infectons, eczema, food allergies, hyperextensible joints, scoliosis, retention of primary teeths, aortic anuerysms.","ALLELEID=27553;CLNDISDB=MedGen:C3661900|MONDO:MONDO:0012427,MedGen:C2674574,OMIM:610168,Orphanet:558|MedGen:CN230736|MONDO:MONDO:0019625,MedGen:C4707243,OMIM:PS607086,Orphanet:91387;CLNDN=not_provided|Loeys-Dietz_syndrome_2|Cardiovascular_phenotype|Familial_thoracic_aortic_aneurysm_and_aortic_dissection;CLNHGVS=NC_000003.12:g.30674228C>T;CLNREVSTAT=criteria_provided,_multiple_submitters,_no_conflicts;CLNSIG=Pathogenic;CLNSIGSCV=SCV000250946|SCV000318324|SCV000776687|SCV004839378|SCV005413570;CLNVC=single_nucleotide_variant;CLNVCSO=SO:0001483;CLNVI=ClinGen:CA020661|OMIM:190182.0014|UniProtKB:P37173#VAR_029760;GENEINFO=TGFBR2:7048;MC=SO:0001583|missense_variant;ORIGIN=1;RS=104893811","criteria_provided,_multiple_submitters,_no_conflicts",0.051,SNV,GT:AD:AF:DP:F1R2:F2R1:SB,"0/1:64,3:0.051:67:31,1:22,1:25,39,1,2",1949.0,59.0,Male,British,,,"G40.9 Epilepsy, unspecified|G56.0 Carpal tunnel syndrome|I10 Essential (primary) hypertension|M17.9 Gonarthrosis, unspecified|M25.5 Pain in joint|M25.51 Pain in joint (Shoulder region)|M25.8 Other specified joint disorders|M51.3 Other specified intervertebral disk degeneration|M54.5 Low back pain|M79.4 Hypertrophy of (infrapatellar) fat pad|M79.6 Pain in limb|T81.8 Other complications of procedures, not elsewhere classified|Z51.2 Other chemotherapy","G56.0 Carpal tunnel syndrome|M25.5 Pain in joint|M25.51 Pain in joint (Shoulder region)|M25.8 Other specified joint disorders|M51.3 Other specified intervertebral disk degeneration|M79.4 Hypertrophy of (infrapatellar) fat pad|T81.8 Other complications of procedures, not elsewhere classified","G40.9 Epilepsy, unspecified|I10 Essential (primary) hypertension|M17.9 Gonarthrosis, unspecified|M54.5 Low back pain|M79.6 Pain in limb|Z51.2 Other chemotherapy",hypertension|epilepsy,,,3.27,,26.14,27.9,86.6,110.7,,2.17,31.52,30.43,34.08,89.29,8.62,100.82,80.38,0.69,10.02,3.63,52.7,0.0,0.0,245.8,0.211,15.99,4.98,12.66,0.088,1.773,6.88,,"['3.63', '3.5', '3.66', '3.64', '3.49']","['2.62', '2.68', '2.81', '2.74', '2.71']"
2153324,chr7,93103153,C,T,missense_variant,MODERATE,SAMD9,,2.053e-06,Pathogenic/Likely_pathogenic,ENST00000379958.3:c.2945G>A,ENSP00000369292.2:p.Arg982His,SAMD9 (GOF),617053,"IUGR with gonadal abnormalities, adrenal failure, MDS with chromosome 7 aberrations, predisposition to infections, enteropathy, absent spleen","ALLELEID=550604;CLNDISDB=MONDO:MONDO:0014888,MedGen:C4284088,OMIM:617053,Orphanet:494433|MedGen:C3661900;CLNDN=MIRAGE_syndrome|not_provided;CLNHGVS=NC_000007.14:g.93103153C>T;CLNREVSTAT=criteria_provided,_multiple_submitters,_no_conflicts;CLNSIG=Pathogenic/Likely_pathogenic;CLNSIGSCV=SCV000803860|SCV001364302|SCV001872888|SCV002257951;CLNVC=single_nucleotide_variant;CLNVCSO=SO:0001483;CLNVI=ClinGen:CA368189192;GENEINFO=SAMD9:54809;MC=SO:0001583|missense_variant;ORIGIN=33;RS=1554336974","criteria_provided,_multiple_submitters,_no_conflicts",0.511,SNV,GT:AD:AF:DP:F1R2:F2R1:SB,"0/1:25,25:0.511:50:11,10:10,11:13,12,13,12",1961.0,46.0,Female,Caribbean,,,"D57.3 Sickle-cell trait|E04.2 Non-toxic multinodular goitre|K80.1 Calculus of gallbladder with other cholecystitis|M00.06 Staphylococcal arthritis and polyarthritis (Lower leg)|M06.96 Rheumatoid arthritis, unspecified (Lower leg)|M06.99 Rheumatoid arthritis, unspecified (Site unspecified)|M17.0 Primary gonarthrosis, bilateral|M17.1 Other primary gonarthrosis|M17.9 Gonarthrosis, unspecified|M21.06 Valgus deformity, not elsewhere classified (Lower leg)|M24.86 Other specific joint derangements, not elsewhere classified (Lower leg)|M65.96 Synovitis and tenosynovitis, unspecified (Lower leg)|O13 Gestational [pregnancy-induced] hypertension without significant proteinuria|O72.0 Third-stage haemorrhage|Z37.0 Single live birth","E04.2 Non-toxic multinodular goitre|K80.1 Calculus of gallbladder with other cholecystitis|M17.1 Other primary gonarthrosis|M17.9 Gonarthrosis, unspecified|M24.86 Other specific joint derangements, not elsewhere classified (Lower leg)|O72.0 Third-stage haemorrhage","D57.3 Sickle-cell trait|M00.06 Staphylococcal arthritis and polyarthritis (Lower leg)|M06.96 Rheumatoid arthritis, unspecified (Lower leg)|M06.99 Rheumatoid arthritis, unspecified (Site unspecified)|M17.0 Primary gonarthrosis, bilateral|M21.06 Valgus deformity, not elsewhere classified (Lower leg)|M65.96 Synovitis and tenosynovitis, unspecified (Lower leg)|O13 Gestational [pregnancy-induced] hypertension without significant proteinuria|Z37.0 Single live birth",hypertension|rheumatoid arthritis|cataract|eye/eyelid problem|thyroid problem (not cancer)|cholelithiasis/gall stones,,,6.49,11.4,15.0,18.1,51.5,79.6,595.7,2.53,38.42,29.71,32.88,90.35,9.24,112.51,81.34,0.54,8.28,3.24,49.2,0.0,0.0,285.5,0.263,16.24,4.405,14.26,0.053,1.195,6.58,,,
2153483,chr9,99142664,G,A,missense_variant,MODERATE,TGFBR1,6.573e-06,1.368e-06,Pathogenic/Likely_pathogenic,ENST00000374994.9:c.934G>A,ENSP00000364133.4:p.Gly312Ser,Loeys Dietz syndrome due to TGFBR1 deficiency,609192,"Recurrent respiratory infectons, eczema, food allergies, hyperextensible joints, scoliosis, retention of primary teeths, aortic anuerysms.","AF_EXAC=1e-05;ALLELEID=210182;CLNDISDB=MONDO:MONDO:0019625,MedGen:C4707243,OMIM:PS607086,Orphanet:91387|MONDO:MONDO:0012212,MedGen:C4551955,OMIM:609192,Orphanet:60030,Orphanet:97295|MedGen:C3661900|MONDO:MONDO:0018954,MedGen:C2697932,OMIM:PS609192,Orphanet:60030|MedGen:CN078214|MONDO:MONDO:0007566,MedGen:C0546476,OMIM:132800,Orphanet:65748;CLNDN=Familial_thoracic_aortic_aneurysm_and_aortic_dissection|Loeys-Dietz_syndrome_1|not_provided|Loeys-Dietz_syndrome|Familial_aortopathy|Multiple_self-healing_squamous_epithelioma;CLNHGVS=NC_000009.12:g.99142664G>A;CLNREVSTAT=criteria_provided,_multiple_submitters,_no_conflicts;CLNSIG=Pathogenic/Likely_pathogenic;CLNSIGSCV=SCV000250886|SCV000264244|SCV000318188|SCV000918303|SCV001354742|SCV002240761|SCV002526699|SCV004010843|SCV004840409|SCV005679463;CLNVC=single_nucleotide_variant;CLNVCSO=SO:0001483;CLNVI=ClinGen:CA043448;GENEINFO=TGFBR1:7046;MC=SO:0001583|missense_variant;ORIGIN=1;RS=760079636","criteria_provided,_multiple_submitters,_no_conflicts",0.361,SNV,GT:AD:AF:DP:F1R2:F2R1:SB,"0/1:24,13:0.361:37:9,7:13,5:12,12,6,7",1941.0,67.0,Female,British,,,"J44.0 Chronic obstructive pulmonary disease with acute lower respiratory infection|M81.9 Osteoporosis, unspecified",J44.0 Chronic obstructive pulmonary disease with acute lower respiratory infection,"M81.9 Osteoporosis, unspecified",asthma|bronchitis|hayfever/allergic rhinitis|osteoarthritis|chronic obstructive airways disease/copd,,,6.96,,17.99,28.1,20.3,70.3,268.3,2.12,31.67,32.07,33.95,94.49,8.54,104.8,85.36,0.34,5.08,3.92,58.7,0.0,0.0,346.1,0.295,15.73,3.88,12.95,0.044,1.135,6.68,,,
2176189,chr8,60852673,C,T,stop_gained,HIGH,CHD7,,0.0,Pathogenic,ENST00000423902.7:c.6070C>T,ENSP00000392028.1:p.Arg2024Ter,CHARGE syndrome due to CHD7 deficiency,214800,"Coloboma, heart anomaly, choanal atresia, intellectual disability, genital and ear anomalies, CNS malformation, some are SCID-like and have low TRECs","ALLELEID=537835;CLNDISDB=MeSH:D030342,MedGen:C0950123|MONDO:MONDO:0008965,MedGen:C0265354,OMIM:214800,Orphanet:138|MedGen:C3661900;CLNDN=Inborn_genetic_diseases|CHARGE_syndrome|not_provided;CLNHGVS=NC_000008.11:g.60852673C>T;CLNREVSTAT=criteria_provided,_multiple_submitters,_no_conflicts;CLNSIG=Pathogenic;CLNSIGSCV=SCV000781109|SCV001582550|SCV001779705|SCV004923872;CLNVC=single_nucleotide_variant;CLNVCSO=SO:0001483;CLNVI=ClinGen:CA371324068;GENEINFO=CHD7:55636;MC=SO:0001587|nonsense,SO:0001627|intron_variant;ORIGIN=1;RS=1360515765","criteria_provided,_multiple_submitters,_no_conflicts",0.149,SNV,GT:AD:AF:DP:F1R2:F2R1:SB,"0/1:35,8:0.149:43:21,2:11,3:10,25,4,4",1966.0,41.0,Male,British,,,"E78.0 Pure hypercholesterolaemia|I10 Essential (primary) hypertension|I20.9 Angina pectoris, unspecified|R07.4 Chest pain, unspecified","R07.4 Chest pain, unspecified","E78.0 Pure hypercholesterolaemia|I10 Essential (primary) hypertension|I20.9 Angina pectoris, unspecified",unclassifiable,,,0.69,,38.33,34.9,25.6,83.5,372.1,1.1,13.0,32.5,36.3,89.6,8.8,109.9,83.1,0.5,5.5,6.7,77.7,0.0,0.0,233.0,0.204,16.2,5.06,13.5,0.049,0.97,8.7,,"['4.91', '4.65', '4.5']","['3.77', '3.57', '3.49']"
2177941,chr20,63690172,C,T,stop_gained,HIGH,RTEL1,,8.903e-06,Pathogenic/Likely_pathogenic,ENST00000360203.11:c.2227C>T,ENSP00000353332.5:p.Arg743Ter,DKCA4,616373,"Bone marrow failure, pulmonary and hepatic fibrosis, nail dystrophy, leukoplakia, reticulate skin pigmentation; microcephaly, neurodevelopmental delay","ALLELEID=1444279;CLNDISDB=MONDO:MONDO:0014076,MedGen:C3554656,OMIM:615190|MONDO:MONDO:0014613,MedGen:C4225346,OMIM:616373,Orphanet:2032|MedGen:C3661900;CLNDN=Dyskeratosis_congenita,_autosomal_recessive_5|Pulmonary_fibrosis_and/or_bone_marrow_failure,_Telomere-related,_3|not_provided;CLNHGVS=NC_000020.11:g.63690172C>T;CLNREVSTAT=criteria_provided,_multiple_submitters,_no_conflicts;CLNSIG=Pathogenic/Likely_pathogenic;CLNSIGSCV=SCV002167659|SCV002585896|SCV004209783;CLNVC=single_nucleotide_variant;CLNVCSO=SO:0001483;CLNVI=ClinGen:CA409679930;GENEINFO=RTEL1:51750|RTEL1-TNFRSF6B:100533107;MC=SO:0001587|nonsense,SO:0001619|non-coding_transcript_variant;ORIGIN=1;RS=2145430878","criteria_provided,_multiple_submitters,_no_conflicts",0.47,SNV,GT:AD:AF:DP:F1R2:F2R1:SB,"0/1:39,32:0.47:71:12,15:22,15:17,22,18,14",1947.0,62.0,Male,British,,,"A09.9 Gastroenteritis and colitis of unspecified origin|D50.9 Iron deficiency anaemia, unspecified|K40.9 Unilateral or unspecified inguinal hernia, without obstruction or gangrene|K44.9 Diaphragmatic hernia without obstruction or gangrene|K66.0 Peritoneal adhesions|M15.9 Polyarthrosis, unspecified|M16.9 Coxarthrosis, unspecified|R00.1 Bradycardia, unspecified|Z03.8 Observation for other suspected diseases and conditions|Z53.8 Procedure not carried out for other reasons|Z87.1 Personal history of diseases of the digestive system|Z87.2 Personal history of diseases of the skin and subcutaneous tissue|Z91.0 Personal history of allergy, other than to drugs and biological substances","D50.9 Iron deficiency anaemia, unspecified|K40.9 Unilateral or unspecified inguinal hernia, without obstruction or gangrene|Z03.8 Observation for other suspected diseases and conditions","A09.9 Gastroenteritis and colitis of unspecified origin|K44.9 Diaphragmatic hernia without obstruction or gangrene|K66.0 Peritoneal adhesions|M15.9 Polyarthrosis, unspecified|M16.9 Coxarthrosis, unspecified|R00.1 Bradycardia, unspecified|Z53.8 Procedure not carried out for other reasons|Z87.1 Personal history of diseases of the digestive system|Z87.2 Personal history of diseases of the skin and subcutaneous tissue|Z91.0 Personal history of allergy, other than to drugs and biological substances",,,,0.25,,17.01,20.1,20.0,98.3,256.1,2.03,43.81,32.79,34.12,96.1,9.54,119.34,94.05,0.34,7.26,2.15,46.5,0.0,0.0,225.1,0.214,16.24,4.333,13.56,0.029,0.662,4.63,,"['5.08', '4.83', '4.56']","['3.65', '3.56', '3.43']"
2192180,chr12,49026710,G,A,stop_gained,HIGH,KMT2D,,6.842e-07,Pathogenic,ENST00000301067.12:c.15256C>T,ENSP00000301067.7:p.Arg5086Ter,Kabuki Syndrome 1 due to KMT2D deficiency,147920,"Typical facial abnormalities, cleft or high arched palate, skeletal abnormalities, short stature, intellectual disability, congenital heart defects, recurrent infections (otitis media, pneumonia) in 50% of patients. Autoimmunity may be present","ALLELEID=177139;CLNDISDB=MONDO:MONDO:0016512,MedGen:C0796004,OMIM:PS147920,Orphanet:2322|MedGen:C3661900|MONDO:MONDO:0007843,MedGen:CN030661,OMIM:147920,Orphanet:2322;CLNDN=Kabuki_syndrome|not_provided|Kabuki_syndrome_1;CLNHGVS=NC_000012.12:g.49026710G>A;CLNREVSTAT=criteria_provided,_multiple_submitters,_no_conflicts;CLNSIG=Pathogenic;CLNSIGSCV=SCV000230779|SCV000680774|SCV000893299|SCV002012256|SCV004295031|SCV005200885;CLNVC=single_nucleotide_variant;CLNVCSO=SO:0001483;CLNVI=ClinGen:CA234162;GENEINFO=KMT2D:8085;MC=SO:0001587|nonsense;ORIGIN=1;RS=727503979","criteria_provided,_multiple_submitters,_no_conflicts",0.286,SNV,GT:AD:AF:DP:F1R2:F2R1:SB,"0/1:80,30:0.286:110:20,15:48,10:45,35,15,15",1955.0,52.0,Male,British,,,"F32.9 Depressive episode, unspecified|K57.3 Diverticular disease of large intestine without perforation or abscess|K62.5 Haemorrhage of anus and rectum|K64.1 Second degree haemorrhoids|K64.5 Perianal venous thrombosis",K57.3 Diverticular disease of large intestine without perforation or abscess|K62.5 Haemorrhage of anus and rectum|K64.5 Perianal venous thrombosis,"F32.9 Depressive episode, unspecified|K57.3 Diverticular disease of large intestine without perforation or abscess|K64.1 Second degree haemorrhoids",spine arthritis/spondylitis,,,20.94,,51.27,33.7,55.4,104.4,248.9,1.8,22.0,32.7,34.3,95.3,9.2,106.7,85.2,0.4,4.9,5.7,69.3,0.0,0.0,167.0,0.152,16.4,5.28,13.3,0.091,1.72,8.2,,"['3.91', '3.76', '3.76', '3.75']","['2.79', '2.74', '2.64', '2.62']"
2193890,chr17,16940405,G,T,stop_gained,HIGH,TNFRSF13B,,3.42e-06,Pathogenic,ENST00000261652.7:c.552C>A,ENSP00000261652.2:p.Cys184Ter,TACI deficiency,240500,Variable clinical expression,"ALLELEID=1063848;CLNDISDB=MedGen:C3661900|MONDO:MONDO:0009413,MedGen:C3150354,OMIM:240500,Orphanet:1572;CLNDN=not_provided|Immunodeficiency,_common_variable,_2;CLNHGVS=NC_000017.11:g.16940405G>T;CLNREVSTAT=criteria_provided,_multiple_submitters,_no_conflicts;CLNSIG=Pathogenic;CLNSIGSCV=SCV001583551|SCV002022361;CLNVC=single_nucleotide_variant;CLNVCSO=SO:0001483;CLNVI=ClinGen:CA398519515;GENEINFO=TNFRSF13B:23495;MC=SO:0001587|nonsense;ORIGIN=1;RS=1286642936","criteria_provided,_multiple_submitters,_no_conflicts",0.036,SNV,GT:AD:AF:DP:F1R2:F2R1:PGT:PID:PS:SB,"0|1:87,3:0.036:90:28,1:36,1:0|1:16940402_GA_G:16940402:41,46,1,2",1957.0,52.0,Male,British,,,,,,,,,1.67,,14.92,19.3,28.0,75.2,404.3,2.82,37.61,29.43,34.32,85.75,9.34,101.75,77.74,0.15,2.04,4.37,58.3,0.0,0.0,295.3,0.275,17.07,5.316,12.72,0.07,1.323,7.49,,"['5.15', '5.05', '4.82', '5.06', '5.02', '4.81', '5.17', '5.06', '4.88']","['4.38', '4.29', '4.15', '4.16', '4.19', '3.95', '4.16', '4.07', '3.98']"
